Topic,TopWords
Topic 350,auction jazz belong musician which coltrane parker item saxophone goodman
Topic 351,say have deal minister blair brown country prime issue turkcell
Topic 352,will for sotherton drug green third city two kluft johnson
Topic 353,bez mccririck brother stallone evict big house bookmaker vote face
Topic 354,cantona fan its assault mask original palace fine wear impressive
Topic 355,jayne year for sister mail send that all state virginia
Topic 356,have they fbi from that woodward mail recipient lion virus
Topic 357,for henson minute jone penalty out shane score luscombe kick
Topic 358,brazil mrs billion jazeera lula luiz inflation Brazilian care abduction
Topic 359,for award year good win music prize include nomination vote
Topic 360,tax government could proposal revenue pensioner author far income enforcement
Topic 361,minister country have economic president will international fuel also state
Topic 362,for right office home register sport this power could under
Topic 363,artist usher outkast key boy billboard maroon honour nelly band
Topic 364,wipro rupee forecast premji vivek shah phonographic identify employee software
Topic 365,budget deficit spending will rule bush cut year federal india
Topic 366,one with week number day elvis good next record around
Topic 367,copper howard snooker hall llanelli regulation truancy truant spare championship
Topic 368,they government from home that evidence use secretary detainee law
Topic 369,will sale Indian india set expect also million raise company
Topic 370,foster carer sky subscriber strachan minimum week vary payment meet
Topic 371,collin will llewellyn jone england season team dragon very johnson
Topic 372,west cosby ham school where charge also collin cardiff town
Topic 373,imf tsunami Liberian allowance country estimate exel reconstruction liberia conflict
Topic 374,only number investment who first fourth close confidence morgan year
Topic 375,would say tax brown budget for pay with environmental face
Topic 376,say have that for this also from increase right but
Topic 377,have they that with say out but europe into lab
Topic 378,film star show also nominee British love dead which announce
Topic 379,wal mart skeen gigapixel customer maryland censor delft allege lawsuit
Topic 380,say its economy for with bank year report fall market
Topic 381,police officer chief power hour drinking force cso want licensing
Topic 382,browser firefox microsoft internet version release have user net explorer
Topic 383,china for trade export with growth japan grow strong Japanese
Topic 384,lord law right court against human house home trial charge
Topic 385,top year world second French win play know set British
Topic 386,honda desperation punish
Topic 387,passenger flight compensation new bad weather clarke travel six zorro
Topic 388,its share say financial cut new this than which would
Topic 389,will world game tour four tournament player painkiller king israel
Topic 390,European archo team tivo indoor content archos connected editing involve
Topic 391,reliance anil brother company mukesh board ambani law another india
Topic 392,factory singer smernicki raw realise prodigy arrest witness stone independent
Topic 393,that spam say get user firm one this junk they
Topic 394,for that have they with person this get say new
Topic 395,argentina water tautou agua argentine suez possibility selection French tate
Topic 396,use network file software piracy security base computer pirate firm
Topic 397,grewcock ruddock massive clumsy ruck thumb footwork recklessly accidental individually
Topic 398,video film technology dvd movie big box thunderbird today alone
Topic 399,leave show celebrity with contestant vote series out housemate eviction
Topic 400,price rate growth say fall month have market which inflation
Topic 401,sale christmas store expect retail street report january figure saturday
Topic 402,will this they that but for have you not get
Topic 403,say they that not government child have law there would
Topic 404,director rock event this than award from vera ray angeles
Topic 405,have say that but for will you with take about
Topic 406,laptop child nair negroponte not education per give becky fair
Topic 407,around population task progress life donate trend marvel globe global
Topic 408,say for which that have year this make from with
Topic 409,say that increase for year have tax government country cost
Topic 410,parmalat debt pro protection vote several cable trotter euro bondi
Topic 411,mart wal gun dixie winn bankruptcy retailer store large circuit
Topic 412,through frasca learn bear reaction tetris deduction newsgame Uruguayan gonzalo
Topic 413,dollar add cut against rise tuesday europe opec euro high
Topic 414,blogger blog day service msn sigarchi Iranian which arash iran
Topic 415,consumer lead old hit intel low past set car tip
Topic 416,government not will but say spokesman allow should that marketing
Topic 417,evan all stall sofa evans hellewell toothbrush wander throne furniture
Topic 418,yuko oil Russian have for auction gazprom russia rosneft that
Topic 419,have they for that than take year also with lose
Topic 420,they that say result lift information use can pay about
Topic 421,have new computer its show job market mcdonald ahold food
Topic 422,band all which show good perform music who come name
Topic 423,have would want say they with report claim after last
Topic 424,site that website attack traffic not they computer netcraft lyco
Topic 425,say hunt bbc law have man but ban one would
Topic 426,they person world nation state need problem nuclear future hope
Topic 427,government more under quango council paul britain low make boateng
Topic 428,will make right she who would group bbc British have
Topic 429,film year award star winner which include have cinema friend
Topic 430,ferguson cup unite gigg side united league first manager manchester
Topic 431,information appeal police rule war commissioner action record office fairford
Topic 432,file have say firm they consumer movie could which technology
Topic 433,Muslim sky breach preview guideline insidious unbalanced sleeper unfairly storyline
Topic 434,for with league barcelona time real second madrid half team
Topic 435,ferguson minute leave point player drop off finish arsenal didn
Topic 436,that have rate from rise increase year for should over
Topic 437,melcher bangkok disaster mackenzie airbus turn Thai panel Asian byrd
Topic 438,japan ajax jol Japanese toshitsune wood number longevity birth else
Topic 439,you work which need space house wireless life part signal
Topic 440,airline year will cost plane air ryanair listing carrier bath
Topic 441,minute with from into final score goal over time first
Topic 442,increase job rate rise consumer economy december figure economic three
Topic 443,win from match play andy champion over player against world
Topic 444,drama million episode itv sale winter contrast popular gmt return
Topic 445,ballot kaplan this paper count livid disappointed African statement rfu
Topic 446,pension carer flexible supersede furthermore residency woo candidate smith contribution
Topic 447,london spy bnp course bett resign ukip meeting green suffolk
Topic 448,after ranger time ferguson united drive propaganda negotiate hartson goalkeeper
Topic 449,wale with but they from that Welsh half over try
Topic 450,film tremor more than say mouse with computer person half
Topic 451,novartis Swiss sandoz franc acquisition producer fight hexal drugmaker cream
Topic 452,game play can more player what when machine console gaming
Topic 453,display panel plasma electronics disabled programme efficient motorsport adaptor lcd
Topic 454,catholic rinaldi anelka priest photographer real paparazzi community clear restrain
Topic 455,drink drunk binge scotland home adult speak highland problem comment
Topic 456,they for make than with not say give time person
Topic 457,lord callaghan chancellor British cardiff reform government death judiciary highly
Topic 458,there too minister job policy need bad deputy dinner raise
Topic 459,with but win have open grand chance federer lose hewitt
Topic 460,that phone mobile for this but digital use technology service
Topic 461,film festival show include which war series life also star
Topic 462,ban balco case trial steam hearing date appeal steroid thg
Topic 463,set bate september contract juventus still keep mervyn dry out
Topic 464,hank materialist square santa capture film christmas express polar story
Topic 465,turkey rover deal say that year with talk investment expect
Topic 466,brando role godfather previous reject gangster moustache corleone schulberg native
Topic 467,johnson journalist colour article stent defibrillator fitzpatrick nuj consultation fierce
Topic 468,city tevez moment club talk wednesday Corinthian manager team replace
Topic 469,robot human study companion dautenhahn robotiquette parcel science situation cogniron
Topic 470,device computing will new like give telecom capability value memory
Topic 471,with month over European company which also second however set
Topic 472,committee ballet life lord reduce Russian custody reduction death sainsbury
Topic 473,Palestinian nestle economy egypt closure Israeli Egyptian violence pipa israel
Topic 474,gracenote able president fit hand car name host guest vice
Topic 475,have for but that they not say will when game
Topic 476,bank say year find survey will more airline economy many
Topic 477,journalist source eff reporter about court reveal case product legal
Topic 478,play will player they for good have final england after
Topic 479,available use voice opera with person access more text can
Topic 480,for investment with cut from not policy year poverty over
Topic 481,project person three school encourage young first dam remark pupil
Topic 482,mcilroy indoor man European compete world run erfurt team championship
Topic 483,that all test like almost this one way positive well
Topic 484,its dollar rise say profit growth economy for euro hit
Topic 485,offer telewest wmc pvr video carry programme rowland kilgore carter
Topic 486,player dallaglio year henman who captain against johnson play American
Topic 487,but use system more find company not monitor you which
Topic 488,search say you person have help site web can work
Topic 489,document west word through sample workshare dropout pearson heart metadata
Topic 490,prison outbreak reoffend defra justice man plan help cost leigh
Topic 491,for film good award have oscar actor star nomination director
Topic 492,prince harry anelka Nazi apologise nicolas wardle palace apology auschwitz
Topic 493,chip will cell sony for that processor than use work
Topic 494,regiment Scottish army scotland date plan download campaigner defence super
Topic 495,for airline time title much technology sign both player part
Topic 496,line drug together that reopen this identify form area profit
Topic 497,sitcom comedian gervais gervai stiller comic flanimal book batman bitch
Topic 498,robinson england leicester for wale will player centre bath week
Topic 499,use rule speaker blackberry chamber common send chair martin debate
Topic 500,that have music person they will can more about want
Topic 501,would have say for with plan back cut but long
Topic 502,have company which business pay firm should share money financial
Topic 503,aid delay disadvantage repeat resort residency beith arbitrary reassert heap
Topic 504,arsenal from henry almunia fabrega toure sub kenny penalty ful
Topic 505,year will with for last would who week want hit
Topic 506,rochus coria chela ignacio olivier hardcourt hewitt delighted koogle unbelievable
Topic 507,law directive invention patent drogba computer legal European large not
Topic 508,will technology person say can net change need way about
Topic 509,that with have say this for from but they who
Topic 510,say have should inquiry about judge new official woolf criminal
Topic 511,game industry developer duty console video title freeze fuel big
Topic 512,with musical stage spend student turn into producer paul great
Topic 513,new zealand tour black lion all they match umaga test
Topic 514,network mobile technology speed for fast service hsdpa second system
Topic 515,style stage suit mcclaren partizan dress monday onslaught botafogo familiar
Topic 516,country develop immigration some bbc clarke accurate organisation china concern
Topic 517,pig crystal design faction walter overstep humour looking strand void
Topic 518,government company price report trade country president wto fuel down
Topic 519,fox nbc swap wife rdf copycat boxing aftenposten cartilage similarity
Topic 520,scam can internet customer all tell connection radio think modem
Topic 521,rugby Scottish national july bomb stadium dispute case calder aru
Topic 522,search desktop computer software home small user program hard release
Topic 523,brown africa child year rich britain finance nation more chancellor
Topic 524,conte lawsuit three information use against its file who san
Topic 525,high which advertising print week month gain long snap street
Topic 526,game national mido price add look yuko fan movement adapter
Topic 527,about which film story five would have blast murder third
Topic 528,pact schroeder rank miliband david eurozone stability policy unit demerger
Topic 529,
Topic 530,with film have star for year say take hit movie
Topic 531,sale roche retail street newcombe casual splitting pat discounting discount
Topic 532,make new man around competition head see ban pick storm
Topic 533,game sale that release san title than its console sony
Topic 534,say labour tory have party person dem election government for
Topic 535,say game for that they have child play parent not
Topic 536,china Chinese cafe use government construction beij two its gorge
Topic 537,she race world record win year with radcliffe marathon champion
Topic 538,optinrealbig bagle drink seek aim spam law anti send richter
Topic 539,say that have for would who campaign claim can believe
Topic 540,band fightstar hit take busted plan broadway act show artist
Topic 541,that have for not over could more there should from
Topic 542,for but point with out year hope will you win
Topic 543,public freedom act government department provide body from into rupee
Topic 544,sport charlton leed training bartlett kiely riggott hasselbaink initiative club
Topic 545,dvd box takings die johnny horror limited selling tribute classic
Topic 546,for award win nominate writer independent first moreno comedy feature
Topic 547,with two while defence three foster however year report turn
Topic 548,lord chancellor reform house speaker peer bill she its also
Topic 549,she have say simonetti airline company for employee over sky
Topic 550,will more work perform keep early saulnier roddick everything top
Topic 551,device nintendo gaming will screen with look handheld machine while
Topic 552,person consumer because world spam human website fraud war internet
Topic 553,virus microsoft anti software program spyware user its tool firm
Topic 554,against game southampton play wilkinson manager premiership chairman worm bolton
Topic 555,play part which work like show another tell big role
Topic 556,fictional blog community suspend suspension spokesperson right global concern support
Topic 557,they rfid tag survey that use about person say concerned
Topic 558,have its share from firm which plan that access two
Topic 559,than include tape set make show have laser about British
Topic 560,service for they content will broadband network that phone use
Topic 561,wale centre wales team france career learn lot view face
Topic 562,phone mobile they use person new more have handset camera
Topic 563,foreign straw sec commission timewarner reporting restate america secretary all
Topic 564,gadget stuff list will set download programme lover austria essential
Topic 565,world become all news part die lot answer spend consider
Topic 566,music will watch video digital handset broadcast success also portable
Topic 567,linux use software program open base customer workplace source microsoft
Topic 568,that site have for net say they this mail out
Topic 569,report more year lisbon than from economic peoplesoft share its
Topic 570,court child she order parent you father that greer contact
Topic 571,mourinho carling chelsea mcfadden barcelona gerrard jose cudicinus liverpool madrid
Topic 572,fiat own maker audio host podcaster cool point opel outright
Topic 573,disney swansea director bnp between arrest deny shadowcrew link police
Topic 574,service mobile broadcasting standard phone yet demand several download control
Topic 575,they album music great include who band artist group act
Topic 576,she run good European Olympic kelly year holme race championship
Topic 577,dvd ray blu format film high disc studio toshiba definition
Topic 578,year she tour star with after album band top take
Topic 579,education report university heart young morrison injury off mikoliuna ill
Topic 580,country britain British relief demand its membership despite European talk
Topic 581,hdtv definition set line broadcast screen europe broadcaster may accord
Topic 582,bank big Islamic payment country government banking hold most malaysia
Topic 583,holme indoor gold holmes Olympic kelly union prix norwich birmingham
Topic 584,moya cup double singles davis bryan seville second rubber murray
Topic 585,band simpson rock sell fan guitarist venue age tour acclaim
Topic 586,gadget apple list have which top player sony magazine knife
Topic 587,india company investor firm analyst boeing boe contract Indian state
Topic 588,scoggin hendrix guitar hillbilly collect tune beverly stratocaster fender perform
Topic 589,film for good director win award will actor have prize
Topic 590,person camera let music drive million key datum hard control
Topic 591,you they who that from access with when use could
Topic 592,local milburn campaign over flight conservative general they finance election
Topic 593,for labour war should register year country former she green
Topic 594,blunkett home secretary sir have visa quinn inquiry david mrs
Topic 595,they iaaf have test charge Greek athen kenteris ban for
Topic 596,bond debt expect over royale bondholder casino offer friday accept
Topic 597,terrorist house terror trial threat judge attack without liberty suspect
Topic 598,word merriam online webster popular mainstream term bush election last
Topic 599,legendary pretty partnership
Topic 600,top for game say release new sound win have good
Topic 601,say south year demand market that economic over plan public
Topic 602,have that they for not this but good who from
Topic 603,take film office with week top for number release box
Topic 604,account restate earnings accounting borrow lease franchise loan error other
Topic 605,land farm farmer property Venezuelan authority president saldarriaga chavez private
Topic 606,foreign remain group against euro last three reserve friday however
Topic 607,phone mobile laptop not you first this about all from
Topic 608,lee man comic spider marvel stan create character hero power
Topic 609,brown chancellor minister labour role gordon next but would bbc
Topic 610,liverpool have would that parry gerrard not for steven will
Topic 611,film actor win arnold British nominate oscar short work wasp
Topic 612,have independent newspaper which who say show new group hit
Topic 613,shortlist white talent armistead spur exist sir zadie inquisitiveness sayle
Topic 614,musical double metlife bennett producer royal design poppin mary citigroup
Topic 615,sundance redford festival place sukul envelope councillor warehouse factory mainstream
Topic 616,award worldcom bafta first its scrushy name south beat richard
Topic 617,john rampersad show effect ground cache villa famous wonder morquendi
Topic 618,tambien robinov erotic widow jeff joel grasp prisoner successfully fantasy
Topic 619,election labour will for party they tax tory but this
Topic 620,roddick nadal point serve break hold save spaniard then court
Topic 621,mail firm have system receive email spam book surface financial
Topic 622,high refinery pill fuel mean more allowance rate look pay
Topic 623,digital she technology design make such box year video one
Topic 624,computer ethnic minority create career south lot veteran cultural maker
Topic 625,will year make action john job who former earnings new
Topic 626,constitution control will player technology referendum voice media firm film
Topic 627,gamer game title with seed play gaming set first winner
Topic 628,wine French support vintner france fighting lci burgundy distil fnsea
Topic 629,have for year from that would country than britain because
Topic 630,school truant crackdown authority local education attendance truancy previous parenting
Topic 631,don what think great deserve feel didn ever vote well
Topic 632,pirate mladenovic sociedad caribbean ranger william car cannibalism dominica cannibal
Topic 633,have club with they from season last break take for
Topic 634,new vioxx approval merck factory thursday risk may analyst investor
Topic 635,shorts
Topic 636,have that but play not would win who cup they
Topic 637,case sullivan against right after Scottish robson slop action learn
Topic 638,music gameboyzz orchestra gameboy kujda blip group sound album electronic
Topic 639,have that say for with this not from but who
Topic 640,firm credit avoid bail june rescue threaten south delist honour
Topic 641,france reddy equant drug breton seoul ingredient internationally reputation alongside
Topic 642,music for that download per copyright track subscription napster digital
Topic 643,dome millennium close nao public abortive muddle regenerate leigh fiasco
Topic 644,for they use have with only when all now year
Topic 645,car vehicle sale new mini year bmw ford while company
Topic 646,she paver rail wolf beatty balfour charge hatfield kim section
Topic 647,rise business say rate year bank bdo output increase index
Topic 648,howl castle distributor witch wynne child miyazaki hayao animator diana
Topic 649,from say analyst that while buy sector executive february likely
Topic 650,programme download user personal provide viewer fan janet broadband episode
Topic 651,milan play die striker return meyer romeo zoe ronaldo Italian
Topic 652,nachison jowell newspaper casino everywhere vegas turning spaghetti pants motorist
Topic 653,greene race world Olympic collin Spanish obikwelu gatlin prix athen
Topic 654,will country card cost bank damage need nation password week
Topic 655,she have that who when name out after domain like
Topic 656,get you know think but would that player new they
Topic 657,wale ruddock player coach wales this jone mike side nation
Topic 658,game play gaming online hour spend person video time more
Topic 659,mallon east yes sunderland transport observer campaigner interested region robb
Topic 660,marsh stock york insurer executive pharma delay governance delegation scandal
Topic 661,film industry adoption make art only may child god barrier
Topic 662,chelsea header corner area uefa van wide kezman referee block
Topic 663,part bosch faulty bmw recall production mercedes diesel injection pump
Topic 664,thanou test Greek will sprinter drug miss Olympics decision evidence
Topic 665,virgin may company profit queen blue one Australian new chief
Topic 666,hunt hunting dog animal act powy countryside alliance hereford demonstration
Topic 667,frederick agree young stand society arrest elect mock correct electoral
Topic 668,idowu jump edwards triple top indoor sixth madrid gold world
Topic 669,have say there but you that get with can will
Topic 670,tsunami morquendi sir raise lanka sri gupta parker throughout death
Topic 671,its will have company job large executive firm business operation
Topic 672,not that such personal take blog need problem picture about
Topic 673,have that for say its company firm year claim also
Topic 674,chelsea club for argonaut arsenal join everton head from sheffield
Topic 675,say would for have asylum tory howard immigration plan that
Topic 676,have for say more with that from year will company
Topic 677,award for ceremony good nominate oscar present national compete include
Topic 678,wenger fund manager standard dein gill mutual relief distributor form
Topic 679,lufthansa pacific hour bush action take lamberty wartime plane arrival
Topic 680,labour election say blair campaign not figure new have also
Topic 681,bofra portrait painting tate joshua owner collector paint omai reynold
Topic 682,have for also say play after next join week there
Topic 683,number chart one place christmas single top song elvis singles
Topic 684,seafarer carnival cruise ship aurora issue have technology border musselman
Topic 685,mcletchie Scottish interest very tod murray partner conflict six sign
Topic 686,can former will think month person reddy get television could
Topic 687,arsenal madrid football mcclaren see here boro operator van always
Topic 688,fraud report office anti money she mar court case public
Topic 689,grammy wmc Australian video goodrem artist vaile missy pea eyed
Topic 690,xbox dutch michel cruyff lose also preventative johan possess legendary
Topic 691,that say they can there for but not new person
Topic 692,profit browne lord barrel record windfall zealand successful overseas seek
Topic 693,holiff ict challenge air accord booz nashville sprinting activate promoter
Topic 694,ssl condom takeover international benckiser reckitt footwear scholl durex maker
Topic 695,healey leicester tiger heineken biarritz gamble trip west unable switch
Topic 696,industry British income strategy issue christmas country video encourage media
Topic 697,van get for curbishley mapletoft gisbergen gatland murphy penalty good
Topic 698,from for student have come ranger fee president claim when
Topic 699,from world two one record with also than only show
Topic 700,film shoot movie remote day first voice underwood pig white
