Topic,TopWords
Topic 415,half ball dyer side area header yard shot newcastle giannakopoulo
Topic 416,election school will person democracy future health general already early
Topic 417,machine top second teraflop ibm list chart simulator fast climate
Topic 418,cop Democrat but
Topic 419,
Topic 420,they language now more group world music what might news
Topic 421,
Topic 422,
Topic 423,
Topic 424,glazer unite bid board manchester proposal debt approach confirm own
Topic 425,that say for have year they from new than much
Topic 426,
Topic 427,have from for target month but sell its offer new
Topic 428,norwich goal past over just year former premiership favour keep
Topic 429,houston ukip student party look view newspaper then croucher criminally
Topic 430,lab massachusett guinness collaborator psychology synergy noel recession brewery innovative
Topic 431,miyazaki age
Topic 432,fed sony use learning vision several product maker mainstream commercial
Topic 433,rate manufacturing rise interest from growth ism housing price hold
Topic 434,firm ssl product maker reporting competition oxley wage reckitt scholl
Topic 435,trade april export peace aberration Pakistani false plastic bilateral unfavourable
Topic 436,carib cannibalism dominica cannibal sequel pirate william ancestor island caribbean
Topic 437,growth china year from rise economic high than have deficit
Topic 438,ulf straberg update
Topic 439,will insurance inflation rupee insurer expect marsh rate change rise
Topic 440,echo
Topic 441,curry podcasting select area podcaster digit rss bro format source
Topic 442,with they that but all get follow even this there
Topic 443,music release console austria song first blip sound many franchise
Topic 444,
Topic 445,
Topic 446,bellamy Celtic after souness minority shortlist birmingham diploma tomlinson fine
Topic 447,have they that say not for will all from but
Topic 448,year rise say from january housing gallery house figure deloitte
Topic 449,Chinese rover china beij deal official close osi shanghai portal
Topic 450,blast lawyer memon black
Topic 451,all gmt shop regent busy festive internet annie walton enoch
Topic 452,wto kinnock leader process iran application valley baron upper administration
Topic 453,presenter host saturday dance bbc strictly show night passport pair
Topic 454,
Topic 455,diversity
Topic 456,game release which doom year award from its most nintendo
Topic 457,
Topic 458,final friday fiji energy title portugal samoa semi deal thankful
Topic 459,news who register other day use make google site official
Topic 460,sun grid computing hour system already power compute launch service
Topic 461,brown tax cable buyer lib council budget duty pay threshold
Topic 462,blog good nominate vera news this oscar category nomination award
Topic 463,pro rule alliance campaigner expect invalid quorn lawful dodd animal
Topic 464,mercedes daimlerchrysler chrysler fuso profitability hope car algemeen dodge rabb
Topic 465,lieutenant major thompson
Topic 466,card korea creditor credit firm Korean south avoid debt liquidation
Topic 467,that you not can more but system use for with
Topic 468,child project they make gameboyzz orchestra gameboy kujda concert old
Topic 469,kilroy veritas poland
Topic 470,chart song argentina ross singles day grammy two star friday
Topic 471,she ballet very dancer British age markova dame young great
Topic 472,henman madrid belgrave compete minute trafford watkin johnson British clear
Topic 473,say for should not home government into change minister plan
Topic 474,formula everybody recipe
Topic 475,kuznetsova Belgian itf tennis eerdeken positive ephedrine Russian tarpishchev wada
Topic 476,
Topic 477,have that say but this with rate more after could
Topic 478,festival dancehall gig capleton umbrella left scorsese jill august
Topic 479,henman British israel abba seattle Israeli greg rusedski sweden museum
Topic 480,brother big she celebrity show bez channel leave series vote
Topic 481,wmc gun blunkett clarke bill california firearm identity document acquire
Topic 482,
Topic 483,black soul ethnic describe white acknowledge deserve street origin represent
Topic 484,mail site send address message worm microsoft program list help
Topic 485,
Topic 486,
Topic 487,good poppin lane performance manager support important well category beat
Topic 488,
Topic 489,justification
Topic 490,mendelsohn know finale positively venture blood
Topic 491,translate message open language currently malicious too hungary suffix disable
Topic 492,recommission judge vote tabby finalist sharon talent predict entertainment
Topic 493,imf china German forrester local lenovo russia operation pacific dependant
Topic 494,abide kind
Topic 495,wastealot
Topic 496,recapture final wipe
Topic 497,win medal sec track great field gatlin haye honour award
Topic 498,morrison album classroom owen learn injunction wikid gorillaz levy fledging
Topic 499,you cole ashley defar defender contact season hennigar cemetery blatantly
Topic 500,government britain howard say blair question michael poll labour when
Topic 501,moment top Olympic factual gold holme victory she medal television
Topic 502,new from original past this series who love movie magic
Topic 503,
Topic 504,band rem glasgow concert date ticket who gig clarke june
Topic 505,Scottish ferguson connor executive uefa patient artificial situation allow carstair
Topic 506,she appear child rowland morning win deeley mrs present favourite
Topic 507,tie cup great bogdanovic right bailey team alex young major
Topic 508,dornford wednesday
Topic 509,samoa taipei Chinese barlow upside tunisia kenya portugal irb consistently
Topic 510,jamelia mobo female fickle digga rah beenie coldplay comeback audience
Topic 511,Muslim tobacco government iraq company anti among firm smoking professor
Topic 512,that spam mail software user spyware security wireless person buy
Topic 513,with for they say have brown make country this over
Topic 514,select
Topic 515,kent
Topic 516,juninho neill botafogo agent depart midfielder maker official
Topic 517,public service claim media kruger billion banque brass creative policy
Topic 518,together develop project content what any huge right website available
Topic 519,
Topic 520,happy
Topic 521,site council sri lanka tsunami indonesia risk gypsy freeze fund
Topic 522,capriati champion injury Australian open melbourne also philadelphia advanta absent
Topic 523,marvel comic stan man daredevil bear lieberman slice humanity extraordinary
Topic 524,
Topic 525,person they phone from have take use more other than
Topic 526,
Topic 527,service user skype system call net network around hotspot mobile
Topic 528,parking fee wang indoor bono outdoor road mcguinness atomic bandmate
Topic 529,bryan double rubber robredo ferrero carlos juan bob twin crowd
Topic 530,broadband line ofcom connection sign wholesale access llu loop provide
Topic 531,parent bittorrent peer child mpaa film site campaign police legal
Topic 532,which such body into set part research technology think policy
Topic 533,music musician song will deal with audience art group band
Topic 534,sale stall london lichtenstein furniture contemporary poster detakat throne joe
Topic 535,game this offer metal player time play life real from
Topic 536,robot human stern station show how radio companion can dautenhahn
Topic 537,respond use get group keep all aid supply bear load
Topic 538,
Topic 539,nintendo screen game its with device will handheld gamer look
Topic 540,have would minister all from secretary with blair tory which
Topic 541,have with make world honour big set title year first
Topic 542,addicted rend fraction dagger zhang exaggerated son reality behaviour region
Topic 543,bolton carr hierro okocha campo bramble stelio harper butt poole
Topic 544,they band music top rock say new album sound include
Topic 545,contribution
Topic 546,for they say have year this but get who know
Topic 547,win ireland cup draw zealand scrum cap match black winner
Topic 548,
Topic 549,makarov soviet ago kingdom weapon seventh defect risk tribunal downing
Topic 550,tolerate
Topic 551,
Topic 552,
Topic 553,referee prutton heart prso mikoliuna send sfa against dalla redknapp
Topic 554,file bittorrent industry link mpaa server court action peer pinochet
Topic 555,gogh van fortuyn murder death politician burgle pim tolerant unfold
Topic 556,hdtv programme definition set broadcast watch format telekom film channel
Topic 557,bmw its car panke model future gibraltar carmaker rock Gibraltarian
Topic 558,flight Saudi president ivory coast airport passenger after standby arabia
Topic 559,
Topic 560,desert armband grandmother canada urge
Topic 561,wait judy nye blaengwynfi spoiled amanda booker finnigan sebold exploit
Topic 562,mubanga cuba passport briton zambia interrogate louise proceedings afghanistan Christian
Topic 563,lse with its exchange stock bid offer market deutsche china
Topic 564,
Topic 565,not say information help from own theft web discover personal
Topic 566,project have computer this problem internet information work there take
Topic 567,say blog with likely this under make two community come
Topic 568,beat Russian seed match set break spaniard show some donate
Topic 569,but have that they for not will with you get
Topic 570,gigg cap john hughe career captain appropriate alex great motley
Topic 571,pension vote over age old Greek lishman boss state loan
Topic 572,man hunt chamber offence appear police pass protester body spokesman
Topic 573,Olympic radcliffe marathon race champion relay gebrselassie record mile sprint
Topic 574,mousa jurisdiction investigation appeal hotel lawyer sadden colonel carla adequately
Topic 575,price november house odpm inflation halifax fall northern ireland west
Topic 576,informative
Topic 577,she award oscar night winner britain win ceremony vote short
Topic 578,seafarer andreas biometric convention card authenti ilo document sea border
Topic 579,have for will not also say with add claim take
Topic 580,itune population million apple problem reform store recession wood file
Topic 581,england twickenham france bennett kick dublin despite point possession pelous
Topic 582,card internet plastic pin credit total apac consumer service new
Topic 583,georgia after valencia follow ranieri park upson mcmullen replacement eriksson
Topic 584,response
Topic 585,stock life musical policy cut bonus axa theatre market profit
Topic 586,tremor beer mouse million asahi age big malt cursor disease
Topic 587,khan visa norway jawani bihari infectious distressed deportation bag Iranian
Topic 588,war peace iraq blair london Palestinian prime speak violence criticise
Topic 589,debt indonesia tsunami paris creditor minister thailand bakrie moratorium repayment
Topic 590,white england six robinson injury head nation squad jason miss
Topic 591,museum Canadian angeles career age digney los love former late
Topic 592,icbc perform gradually
Topic 593,official financial monsanto bribe its for also investigation agree from
Topic 594,goodbye
Topic 595,person family china use also huge each programme move other
Topic 596,jacobsen secret dobrow investigate read arrest hacker computer hacking intentionally
Topic 597,juninho scott neill compatriot veracruz frustrated destination determine club prise
Topic 598,
Topic 599,film nasdaq share only sale trade list board star commercial
Topic 600,ubisoft president
Topic 601,kilroy party ukip election mep robert country political vote meeting
Topic 602,party kilroy know birmingham school seat later criticise find waste
Topic 603,economic market disaster lose korea corporate major fact trader reconstruction
Topic 604,universe
Topic 605,apple optinrealbig nuclear seek iaea net richter system site country
Topic 606,union public pension choice worker sector government there prescott want
Topic 607,cereal flattering
Topic 608,which product high device accord independent top display rather single
Topic 609,over come market world with upgrade unlikely European long ericsson
Topic 610,mystify
Topic 611,lord house game clarke terrorist change phone clause rule terrorism
Topic 612,country hendrix cross world bolton london candela kiplagat guitarist threaten
Topic 613,crawford winter whelan mcguire poke samuel foster mackie path highly
Topic 614,china bank economy japan for year export growth economic see
Topic 615,guitar stratocaster auction monterey dedicate era standing cooper owen infamous
Topic 616,should party can open davenport election way more candidate grand
Topic 617,French messagelab export vintner tattoo producer hope quarter get france
Topic 618,trick
Topic 619,auditorium
Topic 620,with after set third stage both place into Olympic event
Topic 621,beastie newton lee film use court fee judge university sample
Topic 622,
Topic 623,
Topic 624,say for that they have sell set which move aim
Topic 625,say have site Spanish that for hop but one world
Topic 626,faraj disgruntled
Topic 627,film have movie but hollywood star documentary role spacey slater
Topic 628,they say person this than new now technology with have
Topic 629,from economy quarter prescott singapore milburn state cabinet since claim
Topic 630,festival van which gogh follow threat saddam submission trial court
Topic 631,fiat car loss opel outright Italian alliance want buy saab
Topic 632,site argonaut user server suprnova torrent org salute obe coveted
Topic 633,incapable
Topic 634,gift parent patrol invest where voucher count cash christmas half
Topic 635,that mobile online growth say figure but phone month for
Topic 636,later award
Topic 637,oil pipeline project china macedonia balkan Albanian port aim investment
Topic 638,from they for will good year have come big make
Topic 639,new public production country state media prime huge double thousand
Topic 640,nortel loss previously euro airline teeter audit core customer share
Topic 641,election issue voter core pensioner pension vote policy will exactly
Topic 642,goldsmith sand answer parliamentary lean book accredit unequivocal rehearse serialise
Topic 643,laptop negroponte together
Topic 644,scramble
Topic 645,she
Topic 646,fine
Topic 647,enemy feel goldeneye recognisable capture franchise bizarre testament extensive theme
Topic 648,murray israel second davis scott fischer singles david sherwood aviv
Topic 649,woo recall
Topic 650,argentina water argentine agua tariff this suez utility contribution last
Topic 651,party call not they telephone about but marketing vote commissioner
Topic 652,kicker sonny clinch
Topic 653,firefox browser release mozilla king onestat explorer figure opera certainly
Topic 654,have that for they not with say more new use
Topic 655,tube offer automatic private until
Topic 656,feta bank creditor cheese south cost name lose valentine imf
Topic 657,she allegation medal statement jone probe victor truth Olympics commission
Topic 658,mac revolution van bit technical operating suite keyboard itx bulky
Topic 659,tarantino jason whistle kaplan freddy enjoy ground running cueto elm
Topic 660,driscoll lewsey robinson gara penalty win from hodgson leicester against
Topic 661,airline aer fare executive producer asbestos victim fight produce still
Topic 662,cross seychelle mutu first mauritius briton ethiopia host butler meet
Topic 663,Iraqi hadi alexander blackwatch baghdad private observe investment warmly responsibility
Topic 664,wouldn morris logo forehead barley eye website fisher comic space
Topic 665,wto bilateral counterfeiting telecommunications negotiation price subsidy geoff commitment then
Topic 666,nestle Swiss summer franc mineral earnings affect perrier chocolate prolonged
Topic 667,blog web number msn already service microsoft journal space offer
Topic 668,have cairn share india firm also company after its find
Topic 669,hague say party leader william ambition front tell minister not
Topic 670,futurehead akon dove neo god debut
Topic 671,ahold supplier michael many seafood foodservice daly nettle improperly fraudulently
Topic 672,take net year program last spyware twin write setting attack
Topic 673,vinci brown hank code tom bishop fun fit howard become
Topic 674,thrilled
Topic 675,have you more not when fund good government but give
Topic 676,tansley motorsport disabled left electronic pedal endeavour steering clutch rally
Topic 677,site search use person because website datum tool help way
Topic 678,athletics team britain athen woman holme sport world gardener medal
Topic 679,stamp rickman claw
Topic 680,that brain person team computer research could use device electrode
Topic 681,silk houston walkington mischief criminally eurosceptic insane stand English strengthening
Topic 682,Islamic malaysia sampra couldn didn stick pressure selfish grass whatsoever
Topic 683,
Topic 684,have they drug year for test charge this after ban
Topic 685,labour election local campaign blair sukul postal conference commemoration ward
Topic 686,chart download sale music industry year British singles digital its
Topic 687,Russian sun own giant volzhsky ivanovo announce support
Topic 688,terrorist house terror order home arrest control detention legislation measure
Topic 689,player woodward rugby all coach nation not take get fitness
Topic 690,
Topic 691,rate rise unemployment German january job growth expect economy adjust
Topic 692,ongc gas own deal stake future off aiyar raha petroleum
Topic 693,she this problem new not have say there tell government
Topic 694,gervais gervai stiller script jackson sitcom flanimal ricky comedian haven
Topic 695,you game play good handset title time well technology when
Topic 696,everton frasca almost once hibbert naysmith deflection kilbane spector domination
Topic 697,agassi melzer seed saulnier beat now andy didn jose andre
Topic 698,exciting
Topic 699,matt nation william rugby develop Scottish deny hand very you
Topic 700,line unviable regard intention
Topic 701,blair minister election prime brown africa tony report security speech
Topic 702,
Topic 703,cent game rapper feud while outside protege unit shoot hot
Topic 704,hoddle manager club tottenham spur jone where gray boss caretaker
Topic 705,chase painting art gallery zakuani lockwood dimech leyton garment designer
Topic 706,
Topic 707,ecb sluggish brennan daimlerchrysler schumacher spare underline publish year with
Topic 708,will for say have but with get this year can
Topic 709,jugnot euro figaro depardieu chorus gerard draw godzilla choristes pierre
Topic 710,bank compensation pay sec fund financial firm investor deal fsa
Topic 711,person download programme also industry research episode base content which
Topic 712,telecom france break hodgson play provider advantage fixture strength telephone
Topic 713,savoy restaurant pick
Topic 714,with will game you can that play they this good
Topic 715,brando star role korn godfather actor ronny barker oscar assistant
Topic 716,film director festival oscar child direct role work star castle
Topic 717,idowu edwards triple gold madrid take world phillip indoor jump
Topic 718,will government new all minister that one from not with
Topic 719,film aguilera movie director top comedy favourite michael star julia
Topic 720,die britain any health poor university accuse four soro kelly
Topic 721,fan millwall liverpool trouble charge west ham crowd police chelsea
Topic 722,search artgarden keyword tate rellie browsing bridge helpful tateson jemima
Topic 723,forthcoming householder
Topic 724,out year with retirement promise sector further event increase set
Topic 725,
Topic 726,French cesar france chorus tautou esquive kechiche engagement abdellatif audrey
Topic 727,phillip chance wright good when city campbell season start dunne
Topic 728,virus security user network software that use infect machine computer
Topic 729,sony disney use picture disc its jvc allegiance versus matsushita
Topic 730,music roxy festival band june mackay supergrass wight idlewild isle
Topic 731,sabbath clyde list top kerrang involve reunite without mense gilhaney
Topic 732,lufthansa hour disrupt frankfurt federal German plane instead cancellation taxi
Topic 733,prison department local crime reconvict compel statutory fancy advisory
Topic 734,
Topic 735,
Topic 736,van gisbergen hart green tuiliagi tuilagi chuter healey salute ginsberg
Topic 737,spider profit hulk district sweet deeply multi
Topic 738,claim blackground singer mortem undisclosed twin examine family settlement dismiss
Topic 739,careful redesign
Topic 740,poppin musical julie dame theatre mary sir cameron kelly traver
Topic 741,street fogarty Christian peacefully complaint most chart collaborator corporal coincidental
Topic 742,for award film good she with British bafta win drake
Topic 743,for arrest sentence year say use day after who charge
Topic 744,damage thailand insurance region travel insurer affect hurricane asia least
Topic 745,this Palestinian sundance closure sell yuganskneftegaz festival Asian west half
Topic 746,internet seem foundation extension source york limited extra amount client
Topic 747,brown cut chancellor civil east target westminster budget servant poor
Topic 748,embargo donation arm right that ban code straw with human
Topic 749,business orange ict easymobile brien colour service easygroup embrace founder
Topic 750,government report that lisbon say change out policy cost country
Topic 751,carry vote case also marine guilty position radio into client
Topic 752,standard london also add spend ipv fund million year which
Topic 753,deaf rnid relay conversation textphone emotion webcam ordinary telecom English
Topic 754,texting winter pub word short via unfeasible syne abate scavenger
Topic 755,
Topic 756,software file system say tool that its other program new
Topic 757,sititi
Topic 758,test they athen Greek iaaf will kenteris thanou Olympic Olympics
Topic 759,laura ashley spy executive saaid mohd hunger chief factory retail
Topic 760,fall share new down november exchange idec york monday reach
Topic 761,month firm offer deal but buy acquisition most sign early
Topic 762,film dvd back rwanda hotel format blu cheadle berlin fox
Topic 763,flaw critical security microsoft announce could hole patch fix attack
Topic 764,bet
Topic 765,firefox mozilla population page july campaign firebird core boost user
Topic 766,for year from this with fund add money but interest
Topic 767,spurt downturn mother business
Topic 768,league but harry side murder premiership cup third behind brentford
Topic 769,
Topic 770,without suspect terror trial law home evidence power arrest secretary
Topic 771,physically warchus
Topic 772,have person month come tax money wrong response British january
Topic 773,cyber homeland clout federal task foreign past promote now
Topic 774,shockwaves
Topic 775,digital access divide out who million hosford online predict net
Topic 776,music piracy record download copyright internet digital renner phonographic copying
Topic 777,trek series star enterprise upn sci advert archer paramount rally
Topic 778,boateng appoint appointment commissioner African brent forward step continent high
Topic 779,send message use server too with retrieval cell route halfway
Topic 780,wenger arsenal don boss disgrace last edelman almunia guilty disrepute
Topic 781,right evidence only also international power state make organisation chief
Topic 782,have which say make for this that who other all
Topic 783,tysabri biogen elan sclerosis pml leukoencephalopathy multifocal progressive alzheimer investigator
Topic 784,reuter savings glocer wharf gradual coming weakness headquarters tom mainly
Topic 785,fbi mail virus recipient attachment internet agency warn public this
Topic 786,bath osprey walshe martyn rhodri zurich Celtic affection
Topic 787,have that for say sale also year more profit rise
Topic 788,business vickery mentally demography understanding brink counselling voluntary davos social
Topic 789,
Topic 790,ferguson united unite play saturday nistelrooy van sir february top
Topic 791,
Topic 792,rooney ronaldo unite united manchester yard chance fortune howard carroll
Topic 793,yuko bank deutsche Russian case houston because gazpromneft involve chief
Topic 794,lord scotland ban mcconnell which smoke Scottish smoking parliament smoker
Topic 795,
Topic 796,she ban collin doping sport usada balco test athlete suspend
Topic 797,
Topic 798,world Olympic record bekele mark japan tsutsumi medallist railway birmingham
Topic 799,festival gazprom cinema year jury documentary international state hit foreigner
Topic 800,
Topic 801,book write author live child fiction novel story around paraguay
Topic 802,nomination actor star direct gun year blake angeles drama wine
Topic 803,group label lvmh lacroix falic firm buy brand base plan
Topic 804,duchy income private university prince student committee cornwall generate responsible
Topic 805,British secretary guantanamo foreign law nation emergency bay trial right
Topic 806,
Topic 807,wine industry more online sharing survey video jail get group
Topic 808,mugging nairobi davy retain committee park clara rejoin passive frightening
Topic 809,project dam factory environmental power china gorge government three yangtze
Topic 810,will for after they play right with team out can
Topic 811,leader
Topic 812,local raynsford affordable land afford mutual prenti ladder salary anger
Topic 813,good award with win video mcfadden singer key Irish song
Topic 814,
Topic 815,land acre possess estate landowner steadily allege venezuela document absolutely
Topic 816,sri estimate lanka tsunami damage kumaratunga state rebuild shortfall macroeconomic
Topic 817,textile worker garment pbgc bangladesh wto united Christian lose funding
Topic 818,broadband speed home connection offer service such local net customer
Topic 819,reserve blythe nerve realistically buying tie delighted parliamentary
Topic 820,ben deal store award bening retailer retail sale such some
Topic 821,two lingus between proposal create announce need competitor future opportunity
