Topic,TopWords
Topic 0,county
Topic 1,commission objection letter regulator rate germany mobile efficiently reply overcharge
Topic 2,warner alfonso deal robinov enlist burnett artistry azkaban collaborate whom
Topic 3,final one two year three have last five Australian first
Topic 4,have make scotland super across for bid programme attraction quit
Topic 5,prisoner confess argument crime just ensure want not where row
Topic 6,ministry candidate neck winner ditch amman fax tariff significantly outcome
Topic 7,for that out more will make than but say you
Topic 8,edu club southampton midfielder arsenal stay six saint madrid talk
Topic 9,
Topic 10,tournament mirza round open martinez kuznetsova elia farina hantuchova sfar
Topic 11,
Topic 12,portrait darlington souza owner pande censor paint omai withdraw storage
Topic 13,document information defra word sensitive tool workshare pearson hidden animal
Topic 14,snooker hall spend truancy truant jack white school action meo
Topic 15,statuette British supreme tuesday
Topic 16,tutu guantanamo intensive inmate put
Topic 17,have say but this record its which also year make
Topic 18,law patent software directive invention European parliament draft patenting critic
Topic 19,contract you squad season out say club next end international
Topic 20,European Iraqi iraq president chirac blair French allegedly jacque justice
Topic 21,lucy father nutter shock adoptive marrow sailor conceive maggie dependent
Topic 22,researcher tno viewer create city hartog fix family den detail
Topic 23,brown labour election chancellor party campaign blair gordon letwin poll
Topic 24,have they company its say director who former that file
Topic 25,name award who evan baby million ampa dicaprio decide see
Topic 26,
Topic 27,
Topic 28,agassi against saulnier qualifier ferrero andre youzhny cyril seeded melzer
Topic 29,candidate suspend who news stand comment but chairman select thing
Topic 30,have year say that from than more price market but
Topic 31,beatty railway preparedness gray lea crash bysshe responsibility walker breach
Topic 32,florida state door morrison Norman soft clean choreograph disco lachaise
Topic 33,linux artist ibm one hop hip produce album with its
Topic 34,will digital its for service European from have europe technology
Topic 35,
Topic 36,have say with for they that its this but make
Topic 37,coordinator tactic
Topic 38,phil unmarked
Topic 39,finnish buyer
Topic 40,neumi
Topic 41,that have not with good for person can this than
Topic 42,woman money prize man davenport wimbledon tennis number you phillip
Topic 43,stewardess restrain captain
Topic 44,espn list abba musical fan time Swedish than sell faltskog
Topic 45,search desktop yahoo msn yusuf ultimate eastern enfish google staple
Topic 46,jamieson football kind sectarianism police violence sectarian associate identify group
Topic 47,man sizzla behind woman swear entry tour jamaica victoria label
Topic 48,mart wal prozac advert group lilly drug state newspaper fda
Topic 49,brown blair you say they this prime plan don claim
Topic 50,flagship
Topic 51,show last january million during for paul see bbc black
Topic 52,film star festival actor director life award year which boy
Topic 53,abeyie owusu blade quincy freddie diving jeremie arturo bergkamp henry
Topic 54,mobile phone handset chip operator texa year gsm dmb survey
Topic 55,primera
Topic 56,sale xbox sony console over have houlihan gta figure really
Topic 57,jubilee pence
Topic 58,continue
Topic 59,have that say all drug court against not decision charge
Topic 60,centre mini you just screen media customer when very pcs
Topic 61,mail lion firm email have spam month traffic denial back
Topic 62,guerrouj galmier kenenisa helsinki appearance france how
Topic 63,money write criminal saakashvili tax before shevardnadze former malware hide
Topic 64,game draw who play Celtic series park end team football
Topic 65,indonesia government tsunami British straw freeze affected sri million auxiliary
Topic 66,fry adam guide book voice malkovich freeman galaxy hitchhiker dent
Topic 67,win game they side scotland will two but first bortolami
Topic 68,say that about off may happen some what more believe
Topic 69,jurisdiction
Topic 70,player that music podcast digital ipod have American person million
Topic 71,
Topic 72,
Topic 73,guantanamo lord man bay question torture royal raise begg moazzam
Topic 74,have will for that but would with new want year
Topic 75,knot pamela plastic save
Topic 76,
Topic 77,for with technology control consumer about become able market world
Topic 78,band they for have with that hit include album chart
Topic 79,will you make story television viewer wireless show develop pctvt
Topic 80,will for they party tory person labour can vote would
Topic 81,she film production tour star cancel spear lopez suffer singer
Topic 82,will would abortion high protest steve demonstration england manager decision
Topic 83,survive weblog
Topic 84,lee spider collaborate comic sequel adaptation superhero script screenwriter franchise
Topic 85,company premium number phone bill alert dial rate dialler customer
Topic 86,colour wong student blind read red note study develop can
Topic 87,console laser industry create generation gaming time next conference sony
Topic 88,carson norfolk career nebraska navy resign johnny live deselection hostility
Topic 89,say have person that should more not with there about
Topic 90,bond casino campbell take zorro fleme niven goldeneye brosnan clive
Topic 91,have say with game that for time they company very
Topic 92,balco white review drug ban yushchenko conte steroid list ukraine
Topic 93,
Topic 94,viotti opera fenice conduct theatre massenet orchestra conductor when last
Topic 95,intrusive earthlink safeguard secretly
Topic 96,legal system network moderator help novastream group attack produce supply
Topic 97,they use with more camera for phone person say have
Topic 98,
Topic 99,visa mccune orkney holy hinder atlantic facilitate benchmark maintain amount
Topic 100,you trust can secure information unlock password clark management station
Topic 101,cantona fan mask palace wear time baywatch import unite incident
Topic 102,with from after into see time out six lead which
Topic 103,say star have this for year with include what tell
Topic 104,maiden iron read foo fighter event leed headline band sunday
Topic 105,cartridge printer ink qanta woman chip inkjet lawsuit date make
Topic 106,theme technology vodafone stream there handset date mail useful lot
Topic 107,back with fine two into after world before part about
Topic 108,prince souness harry auschwitz newcastle shearer wear michael former babayaro
Topic 109,ukip believe morris soundbite silk kilroy presidential robert unreformable yorker
Topic 110,ipod mac new job apple market will think mini own
Topic 111,
Topic 112,will say than European age about much pay freeze need
Topic 113,mci verizon that worldcom former qwest bankruptcy bid phone telecom
Topic 114,win new stage long first dibaba battle campaign othello warehouse
Topic 115,copyright boy sampling battle note adam composition chongq acclaimed dismissal
Topic 116,coria unbelievable potito jan heineken thursday concede loss
Topic 117,connick shalt bissell pajama zola jerry casting screenplay unrest factory
Topic 118,six nation mate dragon hodgson coach ahead decision torre moody
Topic 119,dutch bench cruyff michel title yapp autumn tonny dorp neeskens
Topic 120,prime minister claim blair newspaper brown believe what apologise chancellor
Topic 121,dealings
Topic 122,you say for with this its work that can but
Topic 123,fiat romeo alfa ferrarus six motor euro buy arese Italian
Topic 124,carnival cruise aurora slice princess citigroup technical issue large stock
Topic 125,social science shortage committee report key work research add attempt
Topic 126,day want cardinal christmas austria fish ncci find scotland committee
Topic 127,
Topic 128,
Topic 129,drug patient clinical treatment iressa cancer failure trial disease pharmaceutical
Topic 130,jeeve relatively window sapphire necklace doubleclick jewellery wedding tip thank
Topic 131,simonetti airline blog employee delta blogg fictional uniform online suspend
Topic 132,thus
Topic 133,have that say they for with not person who but
Topic 134,lion umaga lord but all war saturday admit driscoll iraq
Topic 135,market news month add hold help leave increase analyst potential
Topic 136,shooting
Topic 137,
Topic 138,they person for from say which that this take one
Topic 139,asylum refugee howard system immigration roma person would control fair
Topic 140,japan yen last year Japanese previous box office take howl
Topic 141,offer share stake archo takeover spend rosemount kodak australia possibility
Topic 142,blair howard election tory labour campaign prime claim michael tony
Topic 143,oil china venezuela contract suv barrel Chinese vehicle chavez petrol
Topic 144,its year from firm profit cost report fuel airline cut
Topic 145,account edwards hear man leave sort process mawrey memory near
Topic 146,bet odds place punter adam bookmaker hill william information sensitive
Topic 147,bob marley america mirror Jamaican partridge reggae football power disrespect
Topic 148,message text morquendi world friend tsunami help when send sri
Topic 149,brown education become africa world also finance bear return slum
Topic 150,supermarket
Topic 151,
Topic 152,
Topic 153,
Topic 154,person confirm october trading both current president possible until family
Topic 155,win game good tennis player last grand title federer top
Topic 156,
Topic 157,love act good rock pop three musical career surprise favourite
Topic 158,you they there about all sport even add need lot
Topic 159,tobacco rover bmw government cigarette smoking smoke maker model monopoly
Topic 160,
Topic 161,film alexander stone cage minority movie box treasure studio disney
Topic 162,mobile phone grow for india market share that say million
Topic 163,use that say firm can person technology user but more
Topic 164,research while rashly herd perfection worthwhile squeeze match tim moment
Topic 165,headache
Topic 166,jame city fowler wright quiet shaun struggle season visitor macken
Topic 167,sentence guilty murder reduce plea murderer guideline reduction woolf judge
Topic 168,she take order who year home would one material actress
Topic 169,shipman pick
Topic 170,sound one audio set surround small will but forum because
Topic 171,capacity schwartz experiment server operating processor software than process folding
Topic 172,service video mobile say music like technology digital programme watch
Topic 173,
Topic 174,lord reform house boothroyd chancellor manifesto when common minister who
Topic 175,moore clothing where fabric smart future property greenfield skin baroness
Topic 176,tube ethel amey piccadilly lovell rail preview underground hire Spanish
Topic 177,season pickering wru timetable intensity impetus sustained overhaul consultant stimulate
Topic 178,tax cut spending plan proposal Welsh turn monday huge able
Topic 179,
Topic 180,virus computer program security user mail company firm will window
Topic 181,child pound use gambling digital keep textbook trick kit experiment
Topic 182,kse pakistan day tsunami lakhani duet karachi tension tribute hour
Topic 183,drink drinker change brewer sweet alcohol minority constable excessive disturbance
Topic 184,bnp griffin follow hatred conspiracy racial leicester bail party damage
Topic 185,fan polar young might offer celebrate wintry gump juliette bridge
Topic 186,that with have not after make new person this when
Topic 187,have monitor datum employer crime firm ami file privacy such
Topic 188,will festival holme michael berlin career feature bear European man
Topic 189,jone devine gigg doubt william djemba ampadu flack ham winger
Topic 190,matteo ladder individual with
Topic 191,say have that but this government would for plan there
Topic 192,make who want band big sell old good leave title
Topic 193,genocide award good belgium gamecube wife non manager playstation thorny
Topic 194,
Topic 195,film screen actor show one version British award star hollywood
Topic 196,police they card would home over spokesman say detain deny
Topic 197,topper
Topic 198,blair brown labour election chancellor prime that gordon after conservative
Topic 199,have that play game with after not will you but
Topic 200,fantasy
Topic 201,control character little you original create far along blinx element
Topic 202,martyn man begg free moazzam arteta mcfadden bay sir visit
Topic 203,tape nogar auction sell rca recording september son engineer song
Topic 204,
Topic 205,could not they but test how such offer last some
Topic 206,say they she that have would claim against take home
Topic 207,
Topic 208,that system say music firm consumer digital technology file she
Topic 209,which will market million year than new machine release say
Topic 210,mcilroy charlton kiely hreidarsson middlesbrough bartlett graham minute riggott boro
Topic 211,redknapp mandaric wigley poise velimir survival pompey inform foot bond
Topic 212,saab godzilla European cadillac opel luxury factory sweden vauxhall motor
Topic 213,winner award prize year final top panel stewart choose literary
Topic 214,ead forgeard dispute wto agreement fighting superjumbo delivery euro aid
Topic 215,mobile service office this train which with such fast offer
Topic 216,wasp try Irish gatland mapletoft birkett voyce hoadley warren dowd
Topic 217,blair climate global emission kyoto sign europe carbon warming protocol
Topic 218,ditto search whom share earn aspect
Topic 219,clark American television host bandstand abc golden recover blooper aretha
Topic 220,she race good holme mark European indoor night woman bit
Topic 221,wpp wipro mrs morning forecast rupee analyst look wigglesworth collier
Topic 222,violent
Topic 223,say have that bank lord this government iraq would interest
Topic 224,have they not which public government for common who could
Topic 225,chart download bpi official independent singles occ delay april format
Topic 226,for will have they with time she there about show
Topic 227,limit driver drink caprice allsop accident safety exceed remain drive
Topic 228,mobile call service phone have million first this network customer
Topic 229,say property report housing price plan some firm buy building
Topic 230,connor tennis lta coach kid jimmy manga something attitude practice
Topic 231,embargo lift johnson guidant buy also stent defibrillator drug heart
Topic 232,dvd trademark viewer illegal featurette conjuring counterfeiter mohabbatein amarishi sentencing
Topic 233,france injury six French centre jean saturday monday weekend call
Topic 234,casual title attract panel hardcore poker halo aspect inflame immerse
Topic 235,south plant africa African kumasi automobile volkswagen toyota study ngom
Topic 236,iaaf she athlete thanou medal athletics guilty doping miss kenteri
Topic 237,say have they for that minister but more against not
Topic 238,agen calvisano mauro aquilla montpellier bollesan fitness recall faith task
Topic 239,
Topic 240,
Topic 241,law lord say suspect right hold home case foreign against
Topic 242,that light silicon use laser make say intel chip paniccia
Topic 243,larne weir move poise mcgeough mccarthy Irish local interested hear
Topic 244,award for film honour actor star role have lewis london
Topic 245,
Topic 246,human how nanoscale everywhere micro wear goodpub auld titanium neuroscientist
Topic 247,
Topic 248,
Topic 249,calder finlay transform
Topic 250,
Topic 251,aid world vaccine need finance treatment add poverty poor African
Topic 252,merrill villalba brewery alternative tribunal lynch thanks cheap skill discrimination
Topic 253,retailer christmas december presley figure festive november previously highlight suit
Topic 254,security software pcs pirate virus piracy patch threat with update
Topic 255,sony psp console she will game release nintendo sell machine
Topic 256,wenger www reign talent stamp
Topic 257,figure gaming say such new certainly offer number friend creation
Topic 258,bill government which say would they proposal charge law will
Topic 259,tourism asia travel tourist currency reinsurer france baht indonesia rupiah
Topic 260,submission manufacture prison jayanti parent sue trade month firm
Topic 261,wonder character buffy female whedon slayer heroine silver joss woman
Topic 262,site that bush blocking website netcraft visitor not also traffic
Topic 263,ireland england have over but they robinson gara game six
Topic 264,two also for will follow which include one west pop
Topic 265,for film she who will award year show also star
Topic 266,she clijster season play because wrist injury wild risk Australian
Topic 267,
Topic 268,simpson comedy office bbc matt write gervais gervai groen ricky
Topic 269,play sony nintendo media device psp handheld also initiative although
Topic 270,world jump championship compete good race second johnson time aaa
Topic 271,dollar price crude oil fall minister help london growth europe
Topic 272,rise increase cbi survey plus output cost balance confidence scale
Topic 273,have say for that with will its from would also
Topic 274,category beat while achievement shameless alan britain meadow shane writing
Topic 275,tariff subsidy shearer newcastle dispute cardiff who riley rice ireland
Topic 276,say that government have not this from would they should
Topic 277,shoot remote control underwood person hunting texa hunt fee session
Topic 278,game london cut staff company news developer save sale some
Topic 279,ice with commercial america interest rink thin perform business professional
Topic 280,ntl rental knell buena volume whereas living columbia
Topic 281,
Topic 282,which week last its take first three for next late
Topic 283,datum case palmer ontrack malfunction rage precious when loss disaster
Topic 284,pact statistics investment fallon coffer expenditure road fiddle count binding
Topic 285,
Topic 286,old product could recycle laptop material design lead petrol industry
Topic 287,for have she year European good but out with man
Topic 288,title European mark who champion qualifying run win will qualify
Topic 289,
Topic 290,health union hiv migrant wcg redress hepatitis firing involved nhs
Topic 291,woman six sexism hewitt eoc conduct gap male seminar maternity
Topic 292,have for but gerrard steven deal say summer also new
Topic 293,have other tell that include new website information with online
Topic 294,Olympic indoor second season European champion finish meeting gardener victory
Topic 295,sale mart wal retailer december postcard same state buy mixed
Topic 296,pixel christie Olympics sharp eat patient advice franci broaden crystal
Topic 297,cement construction Indian nath aggregate majumdar timeframe automatic concrete Swiss
Topic 298,wmc vaile copper national woodside undervaluation xstra fivefold treasurer performance
Topic 299,mobile network technology hsdpa datum second system mbp siemen than
Topic 300,hiv fund rich project proposal day least inoculation eradicate private
Topic 301,unreserved
Topic 302,site screensaver lyco website service with spammer such datum back
Topic 303,have they half win but england six france world think
Topic 304,
Topic 305,sale its have say yugansk yukos court rosneft unit menatep
Topic 306,stade toulousain biarritz have laporte michalak harinordoquy wale ireland they
Topic 307,mobile telekom seminal down
Topic 308,
Topic 309,run marathon ioc bid steve manage exercise relax treadmill road
Topic 310,that mac apple machine computer for mini use cost user
Topic 311,archer suppose yes embarrassing
Topic 312,club league injury winter manchester champion through tuesday manager train
Topic 313,will injury but with not barcelona fuel back say still
Topic 314,allegation
Topic 315,england player rugby club team play ruddock session week thing
Topic 316,set she win second world take break after with birmingham
Topic 317,radio station visual virgin handset listener download enable nokia listen
Topic 318,
Topic 319,
Topic 320,aid africa rich nation conflict debt faith likelihood preventable presidency
Topic 321,for use game person over could how this play they
Topic 322,
Topic 323,
Topic 324,musician file embrace lawsuit swapper internet enthusiastically rockstar accurately hazel
Topic 325,
Topic 326,referendum constitution minister caruana written legendary kent Spanish straw leslie
Topic 327,say that its from could year month growth some see
Topic 328,
Topic 329,pro
Topic 330,gibbons silent
Topic 331,music peel radio show john host three station one huw
Topic 332,have say will club from all there player match well
Topic 333,unilaterally
Topic 334,have for say year this with make than more will
Topic 335,film orlean saw privilege conviction degree
Topic 336,they with use ink firm person security company reader some
Topic 337,citigroup prosecutor financial social bafin report corporate company find chain
Topic 338,
Topic 339,defence deal nao acquisition banking link correspondent report mod disappointed
Topic 340,number with have which follow name such tsunami album other
Topic 341,vioxx redford merck fda heart inhibitor painkiller class administration stroke
Topic 342,slave history loan descendant tragically stockton fax tragic doncaster lender
Topic 343,they from have person about more make government this country
Topic 344,byrd beach circulate skin evolve closely
Topic 345,miresmaeili judo bayern Iranian match russell basketball citizen conclude aviv
Topic 346,gadget list apple mobile first top magazine laptop phone this
Topic 347,banker reinforce
Topic 348,clamp
Topic 349,oil its year would deal million price which over follow
Topic 350,inbev deal with buy adriano stake venture interbrew brewer bath
Topic 351,scholl pixie festival anti carmen nazi adolf resistance hitler African
Topic 352,job government say observer measure ensure loss area require south
Topic 353,
Topic 354,economy year rate economic job fall while interest price create
Topic 355,panda network wolong infant ballad oregon portland biodiversity hemin tightening
Topic 356,blair party what get dem prime you lib tax trust
Topic 357,gene blue speed supercomputer work time computer earth prototype per
Topic 358,bus hanau passenger scotland advert compatible interact concert hiv harris
Topic 359,reliance anil brother mukesh ambani ipcl petrochemical ambanus feud india
Topic 360,castaignede miracle Irish barkley olly
Topic 361,
Topic 362,bot hacker net spam gather guinness researcher honeynet remotely security
Topic 363,
Topic 364,
Topic 365,for that have will say more not from its back
Topic 366,blogger Iranian sigarchus online foreign release blogosphere khamenei khomenei Persian
Topic 367,paisley
Topic 368,edinburgh ireland paterson rain petrie southwell lamont grime duffy ross
Topic 369,lee hero spider real superhero hulk timely imagination frequently age
Topic 370,
Topic 371,research view education very anti intend minister about stem payroll
Topic 372,phone cabir any strain handset firm electronics symbian bug movement
Topic 373,howard election labour issue campaign country michael talk general during
Topic 374,liverpool parry chester future league will rush vaughan uncertain aizlewood
Topic 375,award trotter prize keyboard pcg innovator innovate turkmenistan onshore wares
Topic 376,ebber worldcom fraud sullivan have former firm that charge accounting
Topic 377,man fletcher reggae gay industry lyric concert murder show song
Topic 378,game hour online gaming time life everquest become addiction fun
Topic 379,road
Topic 380,staff scrum zealand quote totally thinker dimensional maintenance flair ruddock
Topic 381,hiv aid company risk pill treatment prevalence disease wef access
Topic 382,davis dee davi right dead hernandez ossie hotel civil cause
Topic 383,injure implement
Topic 384,rule firm company with ball director sell sign off whether
Topic 385,ukraine yushchenko viktor brussels rybachuk kuchma nato wto corruption review
Topic 386,
Topic 387,have say they for but with who there regiment not
Topic 388,yuko bankruptcy its bank gazprom yuganskneftega deutsche analyst Russian legal
Topic 389,robocop herlihy die dan twin blake saw omni macbeth welle
Topic 390,hardy
Topic 391,ticket card bill instead cautious fly tout drive army festival
Topic 392,reddy fuel price subsidy aid meal audio raise develop yudhoyono
Topic 393,campbell alastair woodward zealand strategy manager itself communication act work
Topic 394,dtt optimistic bid conseil sagem mediametrie lille canal receiver pour
Topic 395,
Topic 396,profit euro renault cadbury europe carmaker drink outside dollar western
Topic 397,
Topic 398,open round seed win beat second champion first rusedski play
Topic 399,good comedy vera name drake while support other sundance also
Topic 400,economic rise inflation stock reconstruction investor point ireland tourism exchange
Topic 401,sum open place build grand team company lock experience lord
Topic 402,ginepri wildcard jan san roddick dancevic deceptive donald goldstein robby
Topic 403,iraq contrack reconstruction pco pentagon withdrawal war schnaible arlington scope
Topic 404,howard immigrant impression parent robinson son asylum image quota kick
Topic 405,film oscar for star director with million say good aviator
Topic 406,reddy generic version norvasc intensify lilly exclusive drugmaker name right
Topic 407,for that have say this will all some also but
Topic 408,cameroon sable batie nzame ruben
Topic 409,xstrata neeson lyric liam soho stranmillis belisha glen childhood preacher
Topic 410,gurkha becky sharp offer relief indonesia Indian province help battalion
Topic 411,cotton unique item
Topic 412,she expansion love white quinn fall court ahead secretary hacan
Topic 413,from but give back try william time make through could
Topic 414,from she also evan talk seat despite later party express
