Topic,TopWords
Topic 1222,not euro after close its london give build sale strong
Topic 1223,
Topic 1224,have when who but that out show find vote they
Topic 1225,benitez dudek liverpool jerzy what lomana bennington unlucky deflect titanic
Topic 1226,but break minute game second after back before into first
Topic 1227,opel
Topic 1228,for good who British nomination you actress ray foxx take
Topic 1229,pernod domecq ally whisky seagram food euro rum reorganisation ballantine
Topic 1230,have japan with marsh firm its company market new regulator
Topic 1231,site that website say person dec tsunami net fake contact
Topic 1232,contentious hitler misjudgement cannes cautious minor safe fit
Topic 1233,grewcock robinson cardiff collin before first hansen gavin danny championship
Topic 1234,blair bush also behaviour plan minister expect drug role cso
Topic 1235,for that have they which take after this could but
Topic 1236,residue curbishley after dowell tate clothes police return criminalist bonny
Topic 1237,English marca gary remark bernabeu criticise loco miscreant garrido massachusett
Topic 1238,for say they have with game also will this make
Topic 1239,
Topic 1240,recall mercedes safety vehicle car bosch faulty bmw model daimlerchrysler
Topic 1241,child death scotland custody england court young hold life vulnerable
Topic 1242,surface fast melbourne lleyton hewitt Australian tennis worthy modification lesson
Topic 1243,net broadband iptv internet start about subscriber channel network via
Topic 1244,mcindoe penalty hereford sub mill daniel jame net not warrington
Topic 1245,rigoglioso beardsley purdie crisp opposition
Topic 1246,year company firm for from say which sell buy business
Topic 1247,nuclear its British statement britain country firm could chairman western
Topic 1248,return asylum interest albania care spokesman unaccompanied scheme removal medical
Topic 1249,film world production sundance angel war French during category liberace
Topic 1250,that government foreign this will they say new minister not
Topic 1251,argentina argentine drayton devaluation gold libertadore copa maradona prestige tired
Topic 1252,japan toshitsune old welfare workforce fall seventy elderly birth century
Topic 1253,release record week san aid band game andreas fan sell
Topic 1254,robinson rfu kaplan face livid jonathan defeat disallow remark disappointed
Topic 1255,chepkemei london sharon tomb rico satisfactorily disengage acknowledge describe measure
Topic 1256,software image cornell programming wouldn seven memory music braille coloured
Topic 1257,share takeover business firm foster shareholder southcorp value analyst large
Topic 1258,labour say blair tory party election not conservative minister fox
Topic 1259,court right witness parliament victim case bruvik allow defendant birmingham
Topic 1260,you fox show reality French sometimes berman parker daddy sir
Topic 1261,tod section holyrood Scottish labour prejudice code breach christine nicola
Topic 1262,price for report strong economy demand high fall copper export
Topic 1263,have say that for with year would from not which
Topic 1264,property further arnoldo swathe estate associated length mistake reuter guarantee
Topic 1265,radio technology audience chair file another mtv award specially hotseat
Topic 1266,win final set world she over first lose second say
Topic 1267,worker prescott strike regulation avert withdraw correspondent introduce five mark
Topic 1268,award she good year honour music writer child ceremony grammy
Topic 1269,boerse deutsche london euronext shareholder lse German would clearstream talk
Topic 1270,with band user fightstar towards average personal design university fan
Topic 1271,minister
Topic 1272,access she knight gun haunt jama glamorise shooting practical birmingham
Topic 1273,that have say for not would there take which give
Topic 1274,bollywood india mumbai buhecha catholic send friday channel bombay Indian
Topic 1275,sakhnin bnei murambadoro side stint goalkeeper cup final Nigerian masudi
Topic 1276,ranger Celtic from novo hartson vignal ban firm with old
Topic 1277,for have that say they not also from more person
Topic 1278,broadband line connection via person fcc fast june cable over
Topic 1279,adam future haven actually without
Topic 1280,participation tolerate
Topic 1281,say have for that will they would but not two
Topic 1282,player absolutely cup sign saturday side director end position chairman
Topic 1283,chelsea desailly play win cup milan blues barcelona leg club
Topic 1284,saracen leed border simon side fullarton raiwalui ibanez mcgee kalman
Topic 1285,fortune beckham millionaire plummet alistair simon britney
Topic 1286,spyware program software california window information pcs infest login survey
Topic 1287,casino gambling super Scottish government eight humiliating glasgow scotland handle
Topic 1288,microsoft have program window release which internet version browser for
Topic 1289,lawsuit join allege brother pay hyland lockyer fastow prodigy inspect
Topic 1290,crosby sbc statement iota lynton conversation australia presence attention truth
Topic 1291,sport school club tory developed generous lottery lesson local fund
Topic 1292,interactive bafta category website for bbc year entertainment its music
Topic 1293,hyung proactive reynolds pound Canadian talented fun runner second
Topic 1294,good for win award actor year prize which name have
Topic 1295,have bank will say this its expect big year come
Topic 1296,broker fsa nelly commission lloyd rodger prettejohn urge boycott disclose
Topic 1297,smith csa agency committee system pension she serena payment johnson
Topic 1298,she star young panel winner vote movie old year lead
Topic 1299,paula sec partizan lazio commentate plenty conspire kosenkow goodbye bronze
Topic 1300,corbett dumb reality everything victoria audience fractious sofa bemoan temperamental
Topic 1301,china debt creditor cao ocean membership member trading aircraft ali
Topic 1302,uwb use datum network radio short wireless video way technology
Topic 1303,depp burton barrie cop johnny outlaw wood dark sensitive British
Topic 1304,luscombe mcbryde hal paris wales charvis fitness flanker dragon ruddock
Topic 1305,print street snap fade cheap pro use snappy ink photograph
Topic 1306,before radio think cook finish talent write produce ball couple
Topic 1307,benitez vodafone boss dudek tsuda morrow appoint demand technologically leverkusen
Topic 1308,
Topic 1309,collection versace art roy york auction basquiat sotheby warhol designer
Topic 1310,vote labour election university where seat party war next central
Topic 1311,
Topic 1312,they search engine user pay information site can question show
Topic 1313,blunkett trial law release david government detainee review without charge
Topic 1314,studio ray lomax universal sale toshiba available whose north official
Topic 1315,map satellite voigt consortium need way sertit wadi handy encapsulate
Topic 1316,trail yellowstone happen hartley wiedersehen van gus murder retreat portrayal
Topic 1317,walder narraway mayerhofler stephenson grab goodridge peel await newcastle arm
Topic 1318,oracle takeover ellison hour atmosphere database memorabilia candle flower shrine
Topic 1319,disaster lanka hit sri which india aid tell bad bach
Topic 1320,
Topic 1321,they that have will with more which lose over only
Topic 1322,myer lose ceo allegation graduate increase card
Topic 1323,budget deficit president bush congress proposal administration security operation iraq
Topic 1324,potential
Topic 1325,search desktop yahoo microsoft google many firm amount engine increasingly
Topic 1326,law send legal attorney act marsh executive three make non
Topic 1327,children
Topic 1328,she have that after for time one with from see
Topic 1329,strict
Topic 1330,molyneux populous computer bullfrog avalon fad dungeon colorado grant surrey
Topic 1331,speculation saic idle insist chavez group motivation whose divert boundary
Topic 1332,film musical with spend into title turn life series who
Topic 1333,
Topic 1334,number which play game box time top dvd American first
Topic 1335,there this team season don effect off good right great
Topic 1336,lord woolf judge chancellor political appoint emerge armstrong thin hutton
Topic 1337,royal producer mary history outstanding bennett dark richard prince lyttelton
Topic 1338,information mail access freedom act commissioner beith delete thoma law
Topic 1339,world global around debt rise population friday africa state similar
Topic 1340,profit india month oil price sale half rise quarter year
Topic 1341,fiat car marchionne chief loss morchio demel auto marque boost
Topic 1342,net Chinese makower user real credit mean munich rare restriction
Topic 1343,budget deficit will election economic tax government cut finance chancellor
Topic 1344,normally
Topic 1345,most game its pacific painting duty feel rather assault shoot
Topic 1346,have say moya play win beat this they cup davis
Topic 1347,lance wisely pepsico initiative calorie aid replace
Topic 1348,turkey imf agreement reform loan funding Turkish entry draft agree
Topic 1349,spending consumer ppi datum department rate jump chief little enough
Topic 1350,with band rock singer queen tour may from play music
Topic 1351,have not but life work like you over look part
Topic 1352,award fifa viewer category academy dour prinz blatter accolade televise
Topic 1353,she weather speed house love ago fossil compare just norfolk
Topic 1354,export import knight goods october car parole shakur shoot row
Topic 1355,factory near lille town university east addink hungary siemen skilled
Topic 1356,nbc ahead
Topic 1357,google search with link website make channel after time end
Topic 1358,baros Czech deny pernicious quell milan mystify guess omission upon
Topic 1359,munster leinster campbell mccormack quinlan jackman denis duffy include payne
Topic 1360,lesotho quota leave African owner unceremoniously malaysia inform taiwan maseru
Topic 1361,rosneft yugansk Russian pension cnpc instead fer yukos finance auction
Topic 1362,firm rule oblige henman jail oxley clause break press control
Topic 1363,for have year but will two that from take when
Topic 1364,sunderland murray club loyalty whalley bskyb smartcard unsettling delist consultancy
Topic 1365,future borderer tradition merger king amalgamate barnstorm insensitive aaa severe
Topic 1366,united neville manchester rooney heinze vieira player gary arsenal keane
Topic 1367,they after but say win for have that you will
Topic 1368,shortlist unable proportion certain
Topic 1369,have sell will feature nintendo but launch megapixel like image
Topic 1370,cup hopman philippoussis suffer double event shaughnessy wessel thigh blake
Topic 1371,half goal but off line home score ball not kick
Topic 1372,sullivan santry april britton jolene agio currentily cobh byrne training
Topic 1373,have with this but not player can game after would
Topic 1374,
Topic 1375,mcclaren algeria gas stewart afp dinar butane watan demonstrator flare
Topic 1376,that for this with out all what can about support
Topic 1377,person net now station download find woman anything provide let
Topic 1378,wilson she car free gear raw pressure brake motorcycle sky
Topic 1379,that music player media device portable consumer they want digital
Topic 1380,south
Topic 1381,
Topic 1382,
Topic 1383,plane airline order boe airbus boeing new ryanair option aircraft
Topic 1384,deutsche lse bid boerse offer exchange its euronext executive stock
Topic 1385,say game would lift video for such export playstation could
Topic 1386,fed reserve evidence lift kim break berson sail tightening teddy
Topic 1387,call which they system like with all what rate host
Topic 1388,steel workforce staff amro netherland isg dutch shed acquisition operation
Topic 1389,search web find jeeve result engine santy query clip net
Topic 1390,strike service pension civil public outweigh brighton rattle promise easily
Topic 1391,rugby have england for with squad international robinson after one
Topic 1392,bnp police wale plan leaflet uaf church building post centre
Topic 1393,bush dollar record currency deficit franc colonial ariary malagasy madagascar
Topic 1394,economy that economist rule should rise debt ons fall oecd
Topic 1395,mcclaren boro europe after equaliser quite spirit middlesbrough matter villareal
Topic 1396,ebber worldcom fraud accounting witness deny scott accountant coffee hide
Topic 1397,everton gravesen window kommersant risk transfer hand goodison shortly renationalisation
Topic 1398,city link get bid out group have crossrail wardle territory
Topic 1399,
Topic 1400,
Topic 1401,brown bell relief gordon attack book chancellor bannatyne disunity feud
Topic 1402,referee alleged cate pathetic witness gotty feat henk lodge deco
Topic 1403,price christmas press however retailer street region paulsmeier cut holiday
Topic 1404,peter
Topic 1405,say not tory party they election kennedy tell liberal general
Topic 1406,
Topic 1407,ful entertainment idol presley sillerman girl career hardcastle roster hypocrisy
Topic 1408,sculthorpe gladly fancy sheer strongly skipper doubt lack defence
Topic 1409,use common speaker blackberry chamber martin with can juventus debate
Topic 1410,chelsea match league uefa conference rijkaard boss barcelona carling defeat
Topic 1411,oil yuko deal gas shell remittance control year state westwood
Topic 1412,dawson leicester gloucester squad shaw abbott hazell worsley gomarsall recall
Topic 1413,next
Topic 1414,consider while you ranger number can lennon bargain direction recent
Topic 1415,sayeed unjust odell bedfordshire resign grounds protest chamber private fifth
Topic 1416,neutral
Topic 1417,account kreme senate franchise error ivankoe revelation darling wall honour
Topic 1418,child parent which film include from life with singer mediation
Topic 1419,conte jone she marion television take drug doping anti lie
Topic 1420,sport two might sharon prison regulation convict inquiry relation lord
Topic 1421,sale ford vehicle unit crossover ago motor toyota compare quarter
Topic 1422,kelly pupil dei opus spiritual exam categorically collins unruly contraception
Topic 1423,from club you executive bring focus comment whatever season once
Topic 1424,
Topic 1425,company next than with sale three executive expect number chief
Topic 1426,tory secretary home howard conservative man constituency abuse jowell destruction
Topic 1427,they with have who this not would over out you
Topic 1428,have that say would but for make could there person
Topic 1429,libya asset freeze ban unfreeze gadaravice farhat jealous ronald deem
Topic 1430,christmas song single charity band aid raise chart download cliff
Topic 1431,
Topic 1432,say have howard not issue chief blair Democrat support tory
Topic 1433,probem cobhwoman undignified vaulter accurate plane qualifying rock least
Topic 1434,for award win good director also film oscar with include
Topic 1435,osbourne mart wal ozzy skeen hear word maryland censor daughter
Topic 1436,learn purushotma learning must experiment student teach can lesson powerful
Topic 1437,accord unilever report European trading retailer investment analyst share circuit
Topic 1438,closing
Topic 1439,fannie its market quarter analyst food mae large hit have
Topic 1440,from delta fictional news blog since legal with concern confirm
Topic 1441,good win pick stop cate economics support old get believe
Topic 1442,blogger blog create site you start nachison roche hopkin issue
Topic 1443,chip will find system security into user computer digital hardware
Topic 1444,get celltick broadcast customer picture fact take result push sound
Topic 1445,which number sinclair put toy why include modern original series
Topic 1446,ireland france woodward match will zealand england driscoll fiji samoa
Topic 1447,slug when retro fresh scroll tough visual side title even
Topic 1448,have but you they will that get what there make
Topic 1449,den grantham deplorable angie chrissie anniversary photograph expose apologise print
Topic 1450,absa barclays continue empowerment transaction approval falconer formal retail black
Topic 1451,will its for this which feature opera take well voice
Topic 1452,sally
Topic 1453,gadget digital device player that gaming video about ipod can
Topic 1454,last confirm raise much under executive serious about attack number
Topic 1455,festival attend event bangkok should prater Thai third tsunami kinnaree
Topic 1456,school satellite slate student herren station handheld textbook connect digitise
Topic 1457,mido shalaby egypt Egyptian rejoin match affect portsmouth tottenham hassan
Topic 1458,human war language failure scepticism indictment elite powerful away work
Topic 1459,
Topic 1460,have say that but for its not which take from
Topic 1461,award stab violence johnson white board amor classification conclude name
Topic 1462,lord become portsmouth southampton when into die saint cardiff jim
Topic 1463,technology creative industry donofrio art business pervasive invention set engine
Topic 1464,law jail blame violent warning manhunt reggae favour Jamaican prosecutor
Topic 1465,with place top week thriller meet aviator weekend five focker
Topic 1466,safin cunningham have blair stand agriculture serve down cabinet when
Topic 1467,film star actress tautou also vinci code direct movie novel
Topic 1468,ear
Topic 1469,duran bon footage krim connect update talent sometimes single
Topic 1470,she race from win eviction favourite singer surprise double ladbroke
Topic 1471,passenger transport vehicle mobility elderly weather exoskeleton concept onto speed
Topic 1472,aid alitalia rule brando trend Italian possible fcc landscape swiftly
Topic 1473,
Topic 1474,yuko have Russian gazprom oil russia that company its firm
Topic 1475,jam tate tree artist gallery most label decorate wentworth sculptor
Topic 1476,
Topic 1477,
Topic 1478,network net service how access ensure digital call traffic user
Topic 1479,theatre boy national shortlist festen goat sylvia playwright alan paul
Topic 1480,for say foreign boerse act exchange which with shareholder market
Topic 1481,urban stone hop hip doesn amazing dizzee devon sing originate
Topic 1482,
Topic 1483,member
Topic 1484,club anelka nicolas speak shaun phillip owe apologise window striker
Topic 1485,fox corp news after entertainment sympathetically century film cent move
Topic 1486,wale william dragon blues osprey injury wing fit get start
Topic 1487,disappointing jamie canada
Topic 1488,chip sonaptic processor emerge montieth left handle ibm workstation krewell
Topic 1489,department division between think week also civil meeting least require
Topic 1490,sir minister former nicholas ireland ulster die disabled join disability
Topic 1491,cool whose
Topic 1492,rooney volvi witch quality
Topic 1493,flight concern write sir pre further home Czech leak call
Topic 1494,show woman more than around study man make film home
Topic 1495,have for they that but this get will make only
Topic 1496,holiff set manager johnny accord nashville dabble saul rear promoter
Topic 1497,hospital patient powy health local board hereford Welsh regional bureaucratic
Topic 1498,vivendi marie aware marvin rene costly surround
Topic 1499,poster phone jay def mobile run pass nokia fella roc
Topic 1500,deal share borussia dortmund firm will boost creditor friday its
Topic 1501,for have more year will but country still brown than
Topic 1502,france dominici yachvili davy but likely hooker hard then marlu
Topic 1503,
Topic 1504,
Topic 1505,earnings hit datamonitor suffer responsible report likely wsj brand offering
Topic 1506,rather may affect than language check christ pollard aside basis
Topic 1507,audience january housewife television comparison desperate compare lift celebrity freeview
Topic 1508,tax budget spending cut African cash rand manuel pension social
Topic 1509,
Topic 1510,try henson wale jone penalty for half minute when italy
Topic 1511,game copy title valve life mirza play steam ban Indian
Topic 1512,mobile phone you battery flynn ringtone off market consumer see
Topic 1513,
Topic 1514,exposure nameless coordination wording reinsurer calm claimant jay fifth personal
Topic 1515,that microsoft virus window software use new version security which
Topic 1516,apologise johnson livingstone ken Jewish journalist article sorry row bigley
Topic 1517,spain botin santander trial former hispano payout jose madrid maria
Topic 1518,mathieson herron mcintosh chairman should
Topic 1519,super year bowl with perform jackson sir this hey have
Topic 1520,its net market car cafe creative mobile build with capacity
Topic 1521,
Topic 1522,edinburgh scotland taylor italy glasgow lamont against nation webster paterson
Topic 1523,ebay store month power epa dixie winn bankruptcy analyst electronics
Topic 1524,
Topic 1525,have for with say will which person service they would
Topic 1526,have that for say will they which also from end
Topic 1527,tory say election conservative howard labour tax party vote would
Topic 1528,left equalise psychologically horizon promising situation continue
Topic 1529,woman snoop abc dogg confident law company rape tzeko panagopoulos
Topic 1530,tower speed tfc elevator tall passenger control ascend descend taipei
Topic 1531,campaign mallon north yes transport sunderland campaigner convince turnout area
Topic 1532,they have say plan for tory need cut government can
Topic 1533,for have its which will say make while add when
Topic 1534,aid one large single who aaliyah crash boxing group yet
Topic 1535,newcastle bellamy souness injury bowyer kluivert goal mellor hyypia graeme
Topic 1536,for job new name include domain mutu scotland seven official
Topic 1537,school education child pupil truant parent attendance class penalty improve
Topic 1538,
Topic 1539,sina stake hickey keska purchase nyse favourably rumour note electronic
Topic 1540,llwyd carlsen Welsh campaign elfyn cottage dane unimpressed sophistication merionnydd
Topic 1541,terrorist threat ira British become Islamic opinion terrorism side true
Topic 1542,
Topic 1543,wireless reserve vital staff enable child digital help globio foster
Topic 1544,child plan month new industry programme for maternity parent home
Topic 1545,wale assembly health change government list hutt Welsh waiting patient
Topic 1546,rfid tag that they say person could allow about than
Topic 1547,multiplayer
Topic 1548,butler former critical control labour testimony describe damaging headline bill
Topic 1549,glazer proposal tycoon board magnier rothschild horseracing tampa gill joel
Topic 1550,foreign straw thank britain very rolf flashmob pat idaho beirut
Topic 1551,theatre watch predict premiere swansea xbox anywhere multimedia summer console
Topic 1552,electrolux plant aycliffe separate affect zanussi aeg cooker lawn appliance
Topic 1553,price house rise december market fall rate figure month halifax
Topic 1554,play game who win three group rusedski because then match
Topic 1555,speaker kaprano pursue artist Scottish merit nea commercialised napalm chopin
Topic 1556,unite robson united byrne solskjaer anderson late brebner sensation diamond
Topic 1557,blom
Topic 1558,picture digital image print photo dutch many resolution cinema photographer
Topic 1559,airline cut fuel cost amr carrier airway southwest loss American
Topic 1560,nerve create
Topic 1561,crestfallen shane
Topic 1562,innovation
Topic 1563,
Topic 1564,council tax pensioner income local household system rebate allowance revaluation
Topic 1565,job say economy union low first growth expect january market
Topic 1566,film award good oscar box office nomination nominee lead this
Topic 1567,
Topic 1568,
Topic 1569,
Topic 1570,ask blog blogline search acquisition let would interested site monetise
Topic 1571,liverpool have club gerrard parry chelsea season player league want
Topic 1572,have that they for with time use one like than
Topic 1573,
Topic 1574,
Topic 1575,government union pension service public strike could plan that civil
Topic 1576,
Topic 1577,have say that but not with who from about after
Topic 1578,bosvelt cech galla quietly frenchman series display transfer
Topic 1579,ballot edit resident edinburgh council congestion referendum ballard editing therefore
Topic 1580,numerous painting opera
Topic 1581,country immigration foreign straw constitution asylum try right British argue
Topic 1582,
Topic 1583,galloway king tournament prize bethnal stop stooge foster constituency pro
Topic 1584,scotland africa northern south aus smit visagie humphreys connell wing
Topic 1585,program spyware stowell neat some misamore strihavka criminality clearswift valuable
Topic 1586,
Topic 1587,that use make say for with its more person many
Topic 1588,transmitter koji local
Topic 1589,tax that claim tory labour also with put increase they
Topic 1590,edit
Topic 1591,jansen amoruso lorenzo cartilage reckon dog spell piece maybe tiny
Topic 1592,manufacture survey cip manufacturing pmi input expansion purchasing june komileva
Topic 1593,ashdown waterreus ful clear bellamy ricksen goalkeeper let yard slip
Topic 1594,computer metlife life project element visitor develop technology require professor
Topic 1595,mccall reprieve tannadice mcintyre sack timescale detailed sentiment multiple eddie
Topic 1596,pirate guitarist introduce compensation guy king garfield goin ohio overdose
Topic 1597,
Topic 1598,they there man would time own come against morgan investment
Topic 1599,
Topic 1600,consider
Topic 1601,profit timewarner Welsh advertising internet warner december fourth loss softbank
Topic 1602,economic dollar cuba economy tax market increase much measure growth
Topic 1603,
Topic 1604,anelka moriente madrid bid fernando nicolas newcastle summer propostition scupper
Topic 1605,from not blunkett for britain issue attack forget against system
Topic 1606,will car hybrid cut crisis election agreement motor savings decision
Topic 1607,year say for make that with report rise sale new
