Topic,TopWords
Topic 822,software computer engine internet such piracy network use dod industry
Topic 823,susan
Topic 824,age power work retirement laptop pension employer discrimination include way
Topic 825,labour tory person blair after conference tell rule claim speech
Topic 826,person they all ask rule now should back there very
Topic 827,search google web microsoft speegle answer query user technology msn
Topic 828,burglar householder police force intruder prosecution clarke guidance grossly involve
Topic 829,game arsenal play league back she mourinho chelsea wenger need
Topic 830,that have new for can film when because time could
Topic 831,
Topic 832,person than online become more that internet want google million
Topic 833,say care airline fuel would reduce social tory should more
Topic 834,album music number chart song top three dance star include
Topic 835,
Topic 836,book online university woeful disruptive leclerc digitised bibliography wojcicki archive
Topic 837,bjorn politician keen life interested politics fit change memory behind
Topic 838,
Topic 839,dougla adventure train singh romance diamond swashbuckling shailendra angadias wall
Topic 840,will end final out which way concern research mean from
Topic 841,labour candidate election campaigner save announce ingram rally west foulke
Topic 842,she ban event team chepkemei marathon radcliffe kenya year masai
Topic 843,say lord would not for cut plan that its money
Topic 844,for that they have say person this would will can
Topic 845,biarritz anoeta paseo munster Irish heineken switch stadium real euskarian
Topic 846,poster anti member party fagin website official concern ask person
Topic 847,sec survivor own rape restate retroviral killing settle overshadow too
Topic 848,chelsea minute from arsenal goal time drogba when chance gudjohnsen
Topic 849,Saudi sport arabia ministry foreign education prince develop riyal specialist
Topic 850,darin premiere bobby bosworth nou dee sandra dream blethyn hoskin
Topic 851,chart record new elvis hit scissor rock jeremiah brother talented
Topic 852,
Topic 853,apollo pae depend
Topic 854,
Topic 855,bett green suffolk attend prospective resignation pattern fight
Topic 856,student england funding disadvantaged inequality loan expose grant gnoll reorganisation
Topic 857,cocoa tonne production crop assistance agriculture nigeria programme farmer fao
Topic 858,joss jamelia kenya marketing benson dreadful despise clumping rnb marvin
Topic 859,jackson janet bowl malfunction wardrobe broadcast newscaster fine station charle
Topic 860,star ocean sequel raskin office its project box twelve frank
Topic 861,have say that with for not this would its show
Topic 862,service will have they that call can user such net
Topic 863,have that they for say but not will with who
Topic 864,dvd copy new ripguard macrovision rip technology say protection program
Topic 865,neighbourhood
Topic 866,murder clarkson home defence lawyer mandatory life science opposition accuse
Topic 867,azmat guantanamo station abbasi mubanga qaeda Muslim inadmissible pentagon hero
Topic 868,have that they say this not will would but person
Topic 869,ingram allowance increase consistently proof speed
Topic 870,turkcell deal mobile iran Turkish stake israel network tie parliament
Topic 871,
Topic 872,will they say have over during from movie who list
Topic 873,macintosh click mercurial initiator lisa xerox gui resemble parc san
Topic 874,finsbury include
Topic 875,role child opposite nomination relationship play neverland beauty bafta breakthrough
Topic 876,
Topic 877,
Topic 878,say real minister book stadium meeting madrid they bomb nothing
Topic 879,have that from but for this also sell about make
Topic 880,half hodgson england second dawson out scrum replacement robinson barkley
Topic 881,book minister peston mutual get stand ally claim pair november
Topic 882,dvd robot man commentary making present disc titchmarsh brooding grit
Topic 883,euro sue parmalat financial scandal institution bondi enrico administrator reuter
Topic 884,show million come play fox first wife audience channel don
Topic 885,zealand rugby black new all tour game first australia world
Topic 886,star include have she good actor favourite night play new
Topic 887,share lenovo damage insurance Indonesian ibm still company scale riyadh
Topic 888,singer also perform band love who star rock festival concert
Topic 889,cell computer processor technology intel room link home can power
Topic 890,podcasting curry podcaster listener xml carson rss beautiful hear assortment
Topic 891,kenny ljungberg almost cable tonge jagielka lauren gray blaze lupoli
Topic 892,
Topic 893,broadband user web net with online report say they from
Topic 894,banish immediately
Topic 895,thanou also iaaf tribunal kenteris athen athletics independent Olympics miss
Topic 896,blogger secret tanzi money kleinberg lawsuit college through loach divulging
Topic 897,have for against time club will with leicester play bath
Topic 898,auction jazz parker belong musician coltrane item saxophone goodman benny
Topic 899,kilgore carter cash johnny fire june cancer hank credit song
Topic 900,firm share with company its deal own stake analyst which
Topic 901,manager beattie pearce moye everton galla chelsea gallas initially headbutt
Topic 902,tetsuro
Topic 903,shot pompey side dair hislop portsmouth tip hand horvath quashie
Topic 904,spam show campaign not anti say law plan richard prove
Topic 905,hunt ban support hunting animal rural kill fox not survey
Topic 906,have for say will with they that but make who
Topic 907,buffet
Topic 908,Scottish scotland justice executive stop jamieson offender club praise criminal
Topic 909,dodgy campbell budget give after prime man forecast sweetener dossier
Topic 910,
Topic 911,datum use company say customer trade cost you maintain worth
Topic 912,for have but that will say one make move back
Topic 913,art jame artist quango review russia liken ignorant pugh father
Topic 914,
Topic 915,audrey bold trade uganda standstill treason inland endorse vastly hill
Topic 916,lib dem home mutu promise buyer fail sack inquiry oaten
Topic 917,rugby zealand test woodward baa barbarian gear both look latham
Topic 918,
Topic 919,election tell labour any new common anti say judge prime
Topic 920,party ukip silk kilroy seat European robert hockney verita independence
Topic 921,growth consumer rate economic high spending market economy october increase
Topic 922,gadget list year will essential stuff technology lover must mobile
Topic 923,helen wale saint rugby training Welsh code similar gibb coslett
Topic 924,domain icann name travel such for two approval organisation proposal
Topic 925,fall figure spending month pace basis gross minister takenaka overall
Topic 926,december president opportunity continue online hold rival take first broadcaster
Topic 927,dating match barrier event profile ica pescatore wlt singleton static
Topic 928,scheme solution where research company impact efficiency processing through expert
Topic 929,penalty south lead Irish when montgomery paul for African another
Topic 930,lawsuit sue message texa allege spam damages mail trotter michael
Topic 931,cash machine bank greece window because thiemann atm operate label
Topic 932,china foreign television channel one broadcast radio country square many
Topic 933,
Topic 934,console smoke mainland telephone incident advise
Topic 935,expression
Topic 936,rise average care research level this mortgage group reasonable wale
Topic 937,successive
Topic 938,sign plant ensure may boogeyman far lead rory traumatic enforced
Topic 939,
Topic 940,million work jobless total hartz weather unemployed worker change enough
Topic 941,
Topic 942,whampoa
Topic 943,fiat auto car marchionne Italian industrial valid its protract agnelli
Topic 944,court order luscombe father sidoli legal compulsory bring falconer than
Topic 945,have bookmaker hill william bet will owen odds bond clive
Topic 946,
Topic 947,
Topic 948,have with but for that say not would they from
Topic 949,henry arsenal almunia shot campbell lehmann persie van toure vieira
Topic 950,hewitt russia seed federer quarter croatia davenport serena lleyton roddick
Topic 951,
Topic 952,prince bowle parker mrs charle become couple engagement queen diana
Topic 953,
Topic 954,mermaid bicentennial enjoyment
Topic 955,eastender soap rating figure primetime dirty apparently series remake going
Topic 956,hamm nomar mia fifa bow mexico burner july sub julie
Topic 957,tax increase plan service spending government budget duty raise finance
Topic 958,environment swiftly principal fun royal gritty acrobatic youngster enemy parent
Topic 959,imf debt gold international meeting plan government poor reserve price
Topic 960,champion johnson sec race yell country win cross third last
Topic 961,factory bat occasionally sociable restructure mention fashionable embarrassing progress domestic
Topic 962,use computer common team kyrgyz interface point legitimate conduct pro
Topic 963,rugby glasgow border allister euan saint scotland leed chris ban
Topic 964,shopper shopping buy christmas shop gift sell retailer present sale
Topic 965,say have person with would about its christmas sale work
Topic 966,
Topic 967,password security bank method code ash rsa card individual passcode
Topic 968,say have would that they for not which come leave
Topic 969,native refuse schulberg repeatedly roosevelt tango bertolucci alfr behemoth marlon
Topic 970,
Topic 971,clearance reuter
Topic 972,aero craig join
Topic 973,arrest steal darkprofit jersey carderplanet bulgaria existence hack legitimate station
Topic 974,airport baa runway slavery morgan expansion gatwick canal citizen link
Topic 975,franz festival ferdinand performance only park come new music brit
Topic 976,litre yantai changyu illva china saronno bureau yuan department management
Topic 977,willing industrial
Topic 978,remake could mouse part bod thundercat childhood gerry you clanger
Topic 979,board
Topic 980,she who davenport nair now young william open win cast
Topic 981,woman world tape recently care organisation lose now genocide federal
Topic 982,tevez brazil Corinthian city tranquillity gandulla aire paulo Brazilian strange
Topic 983,bank its banking south share stock group down which loan
Topic 984,
Topic 985,lula bankruptcy bank ibge madrid fund economic adriano leftist salvador
Topic 986,halo release gaming sequel xbox errera everything bungie fan launch
Topic 987,heineken carlsberg mar brewer western mantooth kroner beer degenerative allowance
Topic 988,phone mobile lomu could also kidney jonah testimonial globally messaging
Topic 989,west milburn heart producer battle sample dropout further role dmc
Topic 990,online community newry ippr davy civic cup ebay registration citizen
Topic 991,kennedy iraq lib plan election dem Democrat believe minister visit
Topic 992,callaghan roundabout ethnic fond often remember modern lack torch repackage
Topic 993,
Topic 994,service over car also more information three city neither provide
Topic 995,fairmont alwaleed strand simpson Saudi prince connaught claridge thame quinlan
Topic 996,say have that they for not but which who from
Topic 997,special minister ticket show adviser face monday accept arkansa church
Topic 998,backbencher green squabbling street camp example gordon fear premise drinking
Topic 999,rupee Indian communist announce vis poverty perilously aviation brainchild consume
Topic 1000,Pakistani musharraf pakistan straw bus kashmir dispute divide agree amritsar
Topic 1001,peer network piracy copyright raid plead guilty man that user
Topic 1002,yahoo its engine internet weiner portal dot com believe initial
Topic 1003,dre magazine horrify punch autograph crowd jame attack counter due
Topic 1004,have against for england play game come year ireland win
Topic 1005,that say labour campbell they tory bbc this should claim
Topic 1006,
Topic 1007,goldsmith statement time publish tell action legal minister what say
Topic 1008,minority ethnic black approach race group problem labour one they
Topic 1009,krona asia beringer lager driver usual nearly title spot
Topic 1010,perspective
Topic 1011,
Topic 1012,
Topic 1013,dollar euro currency low oil against tuesday cut asia wednesday
Topic 1014,donation state cap commission laptop debate negroponte gift watchdog introduce
Topic 1015,new but would for take more role will good have
Topic 1016,club bate proposal glazer chelsea bid reject will unite takeover
Topic 1017,game second half first win slam replacement france squad six
Topic 1018,sablan
Topic 1019,have play say but time ferguson week from think cup
Topic 1020,
Topic 1021,
Topic 1022,television nudity broadcast pbs nude indecency malfunction wardrobe unfair inaccurate
Topic 1023,
Topic 1024,dominate
Topic 1025,cafe ryman starbuck intent what
Topic 1026,attack
Topic 1027,benitez liverpool important league champion ready anfield reds xabi biscan
Topic 1028,marry immigration marriage right last office new sham non rimmer
Topic 1029,
Topic 1030,have say that who would from but party not there
Topic 1031,smith greenspan kirkcaldy chancellor modern genius handful honorary fife enhance
Topic 1032,csi show forensic science five scene series fan crime which
Topic 1033,drinking drink mcconnell binge person drunk about this get young
Topic 1034,
Topic 1035,republic ireland switzerland faroe cyprus island israel kerr with match
Topic 1036,paver wolf forest scene scott baretta fantasy sophistication ridley breathe
Topic 1037,mitsubishi financial smfg daiwa japan link firm psa peugeot discussion
Topic 1038,
Topic 1039,musician British mmf embassy succeed speedily impractical petition disadvantaged thanks
Topic 1040,pay cost will company low earn rise hour airline commission
Topic 1041,that have spyware anti microsoft software tool many its they
Topic 1042,mayor Jewish livingstone you comment apologise reporter london camp guard
Topic 1043,
Topic 1044,parmalat Italian creditor debt statement bondi scandal several issue finanziaria
Topic 1045,filmgoer rodger reluctance pire version image
Topic 1046,you mtv player would what farrell career young sex david
Topic 1047,dvd technology blu ray format high definition toshiba disc much
Topic 1048,defender corner find volley jaidi candela jussi wanderer dull doncaster
Topic 1049,have for say that but they from this with not
Topic 1050,dallaglio series second final international cup saturday show beat end
Topic 1051,have but that with for good game from come take
Topic 1052,this new just will French for British most change fight
Topic 1053,rate bank year growth rise economy for month quarter economic
Topic 1054,crude refinery nonetheless mercantile arise test still
Topic 1055,hunting dog opik deer chase poorly category hobday luff unintentional
Topic 1056,
Topic 1057,cup kraft moya roddick break Olympic all saulnier advertising again
Topic 1058,
Topic 1059,digital other its she include design share fiorina media will
Topic 1060,they athen test sprinter miss thanou iaaf Greek Olympics ban
Topic 1061,say election would party there plan government local some public
Topic 1062,source open software microsoft small should linux window company buy
Topic 1063,allander nursing assumption costing quarterly organise suggest
Topic 1064,that have say they more not than this out but
Topic 1065,charlotte spider pig web phinnaeus fan begin
Topic 1066,spammer man themselves leadplex stop deceptive llc advert marketing groundless
Topic 1067,video more next that create website know expect include thousand
Topic 1068,
Topic 1069,contepomi argentina puma rifle aramburu bueno shock kel fortuitous longo
Topic 1070,debate howard kennedy Welsh televise charle referendum present stammer reservation
Topic 1071,have for say that but council not year they also
Topic 1072,
Topic 1073,price oil rise crude barrel month high weather production fall
Topic 1074,charter retail private during kong hong newbridge institutional Scandinavian conservatively
Topic 1075,little walliam nighty julia ant controller chat dibley newcomer
Topic 1076,rule golden japan current Japanese niesr fiscal tax then fund
Topic 1077,say about minister committee electoral could register report have public
Topic 1078,blue virgin share jetstar branson marshal defense slack patrick qanta
Topic 1079,trainor energy consumption notebook recharge pack guzzler ebl separator wringing
Topic 1080,after liverpool gerrard kick referee red but garcia blues ranger
Topic 1081,police drink hayman bat binge drug constable grand euro february
Topic 1082,talk speculation euronext stay derivative constructive continental express source lisbon
Topic 1083,labour milburn party brown chancellor there blair economy would tax
Topic 1084,economy economic growth European kok europe country target bank trade
Topic 1085,country trade export economy for forecast economic thursday policy public
Topic 1086,kasabian meighan roll dark singles cutt badland fiery primal lsf
Topic 1087,million firm its sale market sell company year next have
Topic 1088,spurlock mcdonald libel writer leaflet goldwyn Republican samuel screenplay backer
Topic 1089,school swansea bell citizenship community society cultural faith must teach
Topic 1090,
Topic 1091,ajax johann fortune vacant website slot post
Topic 1092,Chinese because country official talk strategic agency stall geneva describe
Topic 1093,hunt define bradshaw offence act animal napster Norwegian away defra
Topic 1094,san pro rsa city turn wireless its francisco survey series
Topic 1095,
Topic 1096,domain fake site use cell idn dyer user language code
Topic 1097,network spam download industry screensaver technology lyco peer share net
Topic 1098,egypt resource Egyptian exxon gold agreement company protocol miner free
Topic 1099,out person with microsoft its when gig giant both from
Topic 1100,jayne prosecutor state sister mail send year law internet virginia
Topic 1101,media work commission nem drm identify sprinter many lifestyle walker
Topic 1102,have for they that say with from not but time
Topic 1103,will china game prof than japan all march could handheld
Topic 1104,radcliffe foster marathon carer yell york richard paula athlete possible
Topic 1105,that have mobile for can phone from get person such
Topic 1106,authority identity secret enron financial fraud intelligence suspect against after
Topic 1107,page feature organisation autolink direct amazon choose list tuc berlin
Topic 1108,its company firm share takeover have another move krispy bid
Topic 1109,
Topic 1110,book chart harry sixth novel blood carrey july amazon pre
Topic 1111,foster southcorp wine winemaker brewing Australian combination blass beringer opportunistic
Topic 1112,have you she for will not out get with this
Topic 1113,
Topic 1114,foreign embassy straw kabul oporto swaziland jack statement move before
Topic 1115,win final britain there against compete race double home champion
Topic 1116,lord detention human rule clarke judgement ruling trial European carefully
Topic 1117,film oscar academy arnold award art passion gibson screening mel
Topic 1118,initiative activity framework waverley basketball proportion troubled anti physical spokesman
Topic 1119,
Topic 1120,lindsay saga penny fancy loyal sporting loss
Topic 1121,merged generator liberalisation trading development
Topic 1122,law home animal legislation house rifle legal let without accept
Topic 1123,
Topic 1124,johansson
Topic 1125,indoor bond second final jame meeting title run race this
Topic 1126,
Topic 1127,kirwan orquera troncon saturday encounter scrum Italian boot capability afternoon
Topic 1128,
Topic 1129,bill debate decision pressure support euthanasia treatment vote current make
Topic 1130,potato licensing absurd existence executive
Topic 1131,job city keegan boss against add although keen keeper kevin
Topic 1132,corellus gemma garner lonely ecstatic genocide Rwandan romantic jackson nod
Topic 1133,own eight alternative live verge ten instrument david agreeable specimen
Topic 1134,say they there who but year government time programme add
Topic 1135,
Topic 1136,hearing trial former case anderson judge performance champion during set
Topic 1137,production price oil rise company coal group high top soar
Topic 1138,smith scotland patent vogt souness ranger assistant walter experience unite
Topic 1139,pharma cannabis canada approval regulatory countryside cocktail tetrahydrocannabinol satifex mouth
Topic 1140,spain Spanish player aragone england racism federation racist football reye
Topic 1141,firm yang jerry anniversary remarkable april dot decade done handful
Topic 1142,control they have with say can more from cap researcher
Topic 1143,mourinho tour they arrest chelsea place from cup man prince
Topic 1144,mutant book marie guardian fiction armistead leroi eyre susanna norrell
Topic 1145,archive parliament divorce room open history addison testimony page lord
Topic 1146,you get but person where about one off come don
Topic 1147,angel year British division joke sister kate guy while rhapsody
Topic 1148,win take good world with last race next year over
Topic 1149,say election party tory they not that labour howard have
Topic 1150,information staff lack salary dca guidance ready improve leadership customer
Topic 1151,display standard price hdtv plasma panel screen giant buy flat
Topic 1152,with have india consider its collin chief country sign Indian
Topic 1153,from halliwell varga petrov thompson sheridan maloney bryson computer account
Topic 1154,drug santa hank risk child base patient estimate county visa
Topic 1155,varig satellite wilson intervention reai alencar sirius Brazilian compensation rescue
Topic 1156,final match set off first start minute world old claim
Topic 1157,allow could wall person system high office lighting suicide assist
Topic 1158,share from demand for will bond offer both control investment
Topic 1159,
Topic 1160,india Indian favourite while bernath illiterate global baby dollar shorten
Topic 1161,
Topic 1162,
Topic 1163,usher year outkast feature artist performance alicia maroon billboard singer
Topic 1164,for oscar award good film actor foxx swank ray you
Topic 1165,hip rap latinohiphopradio spain production right speak emcee station hot
Topic 1166,will world million develop access country give make information speak
Topic 1167,have they this that get game out very good win
Topic 1168,airway airline flight comair chaos passenger bankruptcy baggage crew sick
Topic 1169,answer not attorney advice own general summary always when tory
Topic 1170,they brand company with peer this most even advert everyone
Topic 1171,hold first minute down with from winner set back but
Topic 1172,will win you but for last not with can there
Topic 1173,open mirza Australian ivanovic crowd melbourne agassi year first bondarenko
Topic 1174,wembley multiplex contractor broadway audit edward legal stadium due dreadfully
Topic 1175,not back just view base book accord bulgaria handle perhaps
Topic 1176,cole chelsea striker wenger arsenal villa persie boss leary carlton
Topic 1177,say have they with government but not system which firm
Topic 1178,
Topic 1179,that for have not but with can this year make
Topic 1180,wolf have get with out who double after early since
Topic 1181,tait master precise middle cornwell bald parling mayerholfer repel swagger
Topic 1182,alessandro mail
Topic 1183,have say they that for with will but over who
Topic 1184,
Topic 1185,strict debate kerry
Topic 1186,singles repertoire provider due
Topic 1187,cherie donoghue sodomy reassess restraint involved unusual explosive kerry always
Topic 1188,from have she there money after find other back report
Topic 1189,
Topic 1190,song good music robbie vote band award album act great
Topic 1191,elgindy fraud royer information attack racketeering mauskopf york agent former
Topic 1192,adam lecture self chairman insight whose atrium balmoral enlightenment emanation
Topic 1193,ireland driscoll ulster easterby murphy Irish horgan player arcy hickie
Topic 1194,screenplay feature which coppola sofia translation actress member lose payne
Topic 1195,drug sativex patient symptom share geoffrey formality licence landmark nervous
Topic 1196,themselves philadelphia berry kent backwards attorney dim
Topic 1197,European rebate france germany talk brussels unemployment negotiation contributor national
Topic 1198,
Topic 1199,member britannia qatar lng society payment building account scheme sheikhdom
Topic 1200,show device technology consumer gadget digital electronics grow drive more
Topic 1201,
Topic 1202,athlete thursday middlesbrough
Topic 1203,scarman casino judge brixton riot tour contamination remember trickery runcorn
Topic 1204,gas say its russia trade company deal supply turkmenistan must
Topic 1205,engine poverty property poor reuter half cylinder population line distribution
Topic 1206,edward manic disappearance preacher call suicide sherry flicker richey holy
Topic 1207,tax account india aston income save vantage relative give investment
Topic 1208,will word network oxford print merriam air web cost michigan
Topic 1209,doherty with hotel london bail singer curfew libertine babyshamble wass
Topic 1210,newspaper telegraph journalist colour tabloid daily reader fitzpatrick nuj circulation
Topic 1211,opportunity slim
Topic 1212,
Topic 1213,brentford against beat yead southampton newcastle northampton burnley crystal forest
Topic 1214,charle for recording ray also jone much winter johnson west
Topic 1215,will world winner award prize also author win writer British
Topic 1216,its deccan oil business production Indian stake while forced cheap
Topic 1217,leaning perpetrator volume
Topic 1218,win have half great captain they wale player with nation
Topic 1219,with country nation they say first help about economic this
Topic 1220,say its year have that market dollar cost expect will
Topic 1221,waste store clean dumpsite environmental radioactive intermediate baker Democrat liberal
