Topic,TopWords
Topic 701,price steel such than cost report big bank ore rate
Topic 702,from after minute second goal off ball liverpool lead shot
Topic 703,they say use which not other move state have face
Topic 704,empower obesity population shift
Topic 705,say have that not they make for would also tell
Topic 706,chart sale for singles music first British include its last
Topic 707,say for will have government country new out spend this
Topic 708,virus security cabir criminal program that network because they use
Topic 709,party labour election minister tory who conservative not voter have
Topic 710,they who but new hold director for tell former project
Topic 711,she say you good take make when charle they not
Topic 712,broadband user service call offer skype access line free connection
Topic 713,say that have for blair plan radio will minister leader
Topic 714,nuclear waste attack transport statement detail nokia card customer store
Topic 715,printer produce photo image print cost fade test pro viewer
Topic 716,show time television same include number output weekend retreat follow
Topic 717,mobile they its with person accord more create two like
Topic 718,have she world year for time athletics country not with
Topic 719,Irish show all get news how image could who other
Topic 720,bus ufj sumitomo both ticket bank mitsubishi mtfg tube kashmir
Topic 721,price mortgage december rise oil level analyst housing month above
Topic 722,say from will they election public iraq blair plan not
Topic 723,glazer club bid unite they have offer interest board proposal
Topic 724,for say health minister patient have executive she hospital month
Topic 725,woman Saudi Arab dirty saud retired stereotype tailor retire graduate
Topic 726,have cash machine brown system new window photo off for
Topic 727,assembly ocean sequel clooney twelve office pitt opening express project
Topic 728,have that say not would with out all give make
Topic 729,
Topic 730,court have case for trial rule say move who right
Topic 731,film she star role actress with director oscar make also
Topic 732,number godzilla brit success move release title three office soldier
Topic 733,most site use broadband information such commerce ordinary internet web
Topic 734,literacy tomlinson learner school numeracy math gcs creative sir leaver
Topic 735,world British will would take show brand predict britain American
Topic 736,album record song one charle morrison not will music sunday
Topic 737,face side west chelsea newcastle oldham beat exeter unite cup
Topic 738,worldcom ebber fraud face director sullivan from accounting chief firm
Topic 739,call have for its that make some not also can
Topic 740,will howard conference make pub fox tory michael argue all
Topic 741,have say that they year give work than who second
Topic 742,say have that they for will make but would should
Topic 743,forum textile border goodman campaigner African steinmetz larkin quota bnei
Topic 744,with say could new they year this show will big
Topic 745,win year award for from william prize top this after
Topic 746,animal committee bill fish fishing government welfare consult draft suffering
Topic 747,airport plan baa expansion heathrow runway stanst aviation community gatwick
Topic 748,for they say will but government have person not with
Topic 749,foreigner baywatch import magazine david surgutneftegaz lukoil lucy makeover crest
Topic 750,japan player henry you cup get don league puzzle wall
Topic 751,map davis ossie davi respond satellite funeral dee activist actor
Topic 752,camera have image they picture print will person photo feature
Topic 753,poster say driver video transport police drink campaign drive two
Topic 754,light use that silicon laser make say paniccia intel chip
Topic 755,that have technology will use game net person like can
Topic 756,job last million new person number also unemployment well between
Topic 757,for standard with use make this technology from group European
Topic 758,csi forensic episode science direct carson tarantino television appear appearance
Topic 759,say roma not rule officer gallagher asset prevent two ruling
Topic 760,have that growth economy rise rate but fall remain show
Topic 761,technology from can company argentina use cinema month some phone
Topic 762,smith agency csa committee johnson pension payment chief departure doug
Topic 763,firm card creditor financial bank its agassi collapse credit against
Topic 764,chelsea play desailly bridge final will player win one milan
Topic 765,player ireland game six rugby that Irish nation scotland great
Topic 766,smoke fine film afi willis smoking bowl super will mcconnell
Topic 767,that with win have not say team well they play
Topic 768,england robinson after hodgson six scrum match out coach side
Topic 769,disaster minister goldsmith advice war military march action gerrard this
Topic 770,ban chelsea drug club with for six player month test
Topic 771,sale price cut high fall bellamy rise fare month same
Topic 772,Muslim turkey vote anti Turkish tamimi mab achievement quite concern
Topic 773,international cross race march take French rad yell rape let
Topic 774,investigation rule civilian mousa jurisdiction military shooting hotel inquiry arrest
Topic 775,say oil year government from price analyst country this rise
Topic 776,bill parliament European software law have draft patent allow protect
Topic 777,ivanovic czink canberra wta castigate katarina raimi ana lucky capture
Topic 778,box office sina shanda boogeyman nominee super still chart cheung
Topic 779,mirza safin Indian title serena slam round grand tennis semi
Topic 780,say that not will apple ipod many system way blair
Topic 781,search google engine yahoo say web ask its user site
Topic 782,plane airline airbus its aircraft boe bbc order mart air
Topic 783,say this roddick win title just beat davis great moya
Topic 784,poster musical milburn millwall liverpool abba appear fagin fly than
Topic 785,robinson rugby football host think union team squad six nation
Topic 786,aviator win actress jamie scorsese foxx eastwood swank staunton hilary
Topic 787,say that they bbc information which not would for all
Topic 788,gwent newport ryan morgan endorse bold colleague sable uninspired dragon
Topic 789,seed but agassi take good break melzer second final win
Topic 790,will for say that have but this not make would
Topic 791,espn language sim honour student great award gatlin haye berlin
Topic 792,music song artist award they first concert kaprano man album
Topic 793,attack they security that target see about datum work more
Topic 794,say they person call for that this with vote more
Topic 795,versace eye collection contemporary york home brass florida death auction
Topic 796,robot asimo design honda hitachi person run foot walk car
Topic 797,blair will minister prime would labour over there tell new
Topic 798,britain person school family face nation tackle Asian its come
Topic 799,league ecb neeson georgia saakashvili anfield chelsea shevardnadze lyric cole
Topic 800,france have they from against half scotland win wale squad
Topic 801,that work jobless make before have further concern German about
Topic 802,wireless clark spector with hotspot secure evil phil twin station
Topic 803,French france cesar long chorus tautou actor jugnot engagement film
Topic 804,lord advice answer goldsmith general statement butler attorney war say
Topic 805,you life open dance out seed set feel environment lomu
Topic 806,bank for mac which apple come cost december central fund
Topic 807,top while jail number christmas entry responsible television bar playstation
Topic 808,say net border many seagrave gambling ddo some can mutu
Topic 809,say have rise rate year bank market house growth from
Topic 810,arsenal cole ljungberg vieira abeyie owusu lupoli harley apprentice aliadiere
Topic 811,with deal from but come about long for all think
Topic 812,mail virus message phishing attack writer poppin messagelab spam steal
Topic 813,smith greenspan adam lecture kirkcaldy economics chancellor fife invite george
Topic 814,player fan like set great help play say johansson captain
Topic 815,apple yapp mansfield develop interface pilkington carlisle orient barnard navigate
Topic 816,ballot transport university charge resident climate passport congestion msps farm
Topic 817,government election deal edward february country coalition new thorpe sir
Topic 818,say have for law government but rule not would they
Topic 819,library google online information material nuclear access book which oxford
Topic 820,liverpool club gerrard chester league parry future offer refuse vaughan
Topic 821,have say its firm drug sony will also since vivendi
Topic 822,have year its with will that but from out growth
Topic 823,phytopharm unilever hoodia cactus pfizer africa slim nomura erl dixey
Topic 824,game will nintendo sony halo play console video handheld psp
Topic 825,target call imf debt also job europe European need childcare
Topic 826,try school second two tower over off first fast inside
Topic 827,spain have coach Spanish england against they aragone make federation
Topic 828,but for player one good while two just half second
Topic 829,production producer billy produce fund will farmer funding consumption term
Topic 830,apple Celtic novo waterreus vignal dougla bellamy firm ricksen leak
Topic 831,would have tax from change debate introduce health want nearly
Topic 832,centre more they but rate worker take europe broker staff
Topic 833,tory tax would say labour howard plan cut have make
Topic 834,have say with this but not take also now out
Topic 835,share studio Saudi ncci use turn first paul last visitor
Topic 836,will festival singer wham film include michael february top which
Topic 837,job that rebate unemployment budget rate president low growth term
Topic 838,use judge sufficient fee battle sample court statute segment adam
Topic 839,file bittorrent that site exeem swap legal network suprnova version
Topic 840,london visit leader author shortlist davo winner canada deal writer
Topic 841,they have but not england for who play against want
Topic 842,
Topic 843,you mobile such phone bit title handset even too graphic
Topic 844,interactive patrol snow hamm Irish website theatre male fifa lightbody
Topic 845,have its yuko for court oil gazprom Russian that company
Topic 846,have that for game say they need with first add
Topic 847,home who would for clarke tell case change could not
Topic 848,that they make content digital you film can for more
Topic 849,have which service with industry they from market creative person
Topic 850,sony gadget show they device much detail despite japan industry
Topic 851,kelly mtv school she education pupil child issue research ruth
Topic 852,mobile more text mda million message send billion december book
Topic 853,remake child magic roundabout love mouse puppet animation door successful
Topic 854,barclays absa card box retail loyalty content whalley stake viewer
Topic 855,have for that they who its say will with claim
Topic 856,ebber stern fraud executive company sullivan former chief ashley accounting
Topic 857,for say more government report there they that should other
Topic 858,have say that for not with this blunkett should include
Topic 859,nelly picket ticket rodger arkansa church boycott lyric venue university
Topic 860,with say have talk for its would make report over
Topic 861,have with but for they win after good game back
Topic 862,legal hear postal june manchester million suicide commit hearing arrive
Topic 863,business aid wef company viktor forum among minister vice gate
Topic 864,china oil Chinese export but from arm ban more government
Topic 865,have country aid state but report development its increase debt
Topic 866,for they from but into make come good hailey once
Topic 867,Russian russia yuko yugansk khodorkovsky rosneft yukos court tax oil
Topic 868,job cut civil service pension strike servant public Welsh department
Topic 869,campbell labour tory mandelson campaigning campaign this about dirty media
Topic 870,from with money investigation office one commission another president senior
Topic 871,toulousain stade for grand last biarritz bourgoin laporte slam say
Topic 872,person say have use service from system user online phone
Topic 873,vote against arnesen time tottenham all fixture referendum this representative
Topic 874,also plan make gay friday attempt itself include will cost
Topic 875,call person about telephone commissioner rule use movement information issue
Topic 876,have say for will they that with get but time
Topic 877,broadband fast operator line such loop fcc unbundle finally connection
Topic 878,its that with will would for business say have add
Topic 879,income tax you what get trust kennedy lib president year
Topic 880,decision mutu ppi Czech sack street case wall move fail
Topic 881,blair prime minister war tony independent strategy iraq chancellor want
Topic 882,have will play ticket day event also that festival they
Topic 883,library johnson edinburgh russia chepkemei yell marathon butler walker ahead
Topic 884,gervai primetime prove British going ecosystem eastender golden secret likes
Topic 885,year super bowl show jackson perform sir beatle nothing last
Topic 886,shareholder deutsche boerse put chief executive investor will euronext stock
Topic 887,high dvd definition dean mean time some see show salary
Topic 888,sale market than sell last fall buy over say recent
Topic 889,have ebber worldcom that company about sullivan financial chief fraud
Topic 890,for london deal company share its lse stock say exchange
Topic 891,election over party will from last four later focus labour
Topic 892,jamieson ranger kind either sectarianism holloway section associate recent fire
Topic 893,that blog get many help make cash tsunami about dec
Topic 894,ulster munster connor leinster easterby horgan arcy player leamy denis
Topic 895,urban she black stone joss soul city from brit term
Topic 896,say have would they that over but should card which
Topic 897,investment foreign market need telecom sector increase firm boost corp
Topic 898,ethnic minority hughe grant curly sadie unafraid contraceptive downdraft sikh
Topic 899,need wait tonne ethiopia russell morgan staff gibbons fullarton raiwalui
Topic 900,high turn next thailand britain revenue earnings investor wednesday stock
Topic 901,blog information net find with survey visitor internet pollmann lanzone
Topic 902,buddy timberlake lotta soulful chrissie overdose group scott
Topic 903,online ebay murder duran virtual auction entropia mandatory single item
Topic 904,flight airway airline airport passenger comair chaos delay bankruptcy advert
Topic 905,beer award international cameroon punishment guilty payroll African boost mean
Topic 906,bank standard jarvis trust stake Nigerian handler tube federal agree
Topic 907,time win race britain get victory champion mark very third
Topic 908,pearce einstein londoner nottingham deem bob apply coaching institution initially
Topic 909,euronext would blunkett boerse bid executive statement david uranium copper
Topic 910,say that have they not would lord for but bill
Topic 911,year drug south hour assault jail concert former last for
Topic 912,that get also have drinking mcconnell executive personal high market
Topic 913,
Topic 914,cairn rajasthan oil find area stam gammell drilling Indian production
Topic 915,have that for say but with will not take get
Topic 916,you with most metal slug title offer even gameplay enemy
Topic 917,they person will which say that for from this but
Topic 918,foster takeover winemaker stake news brewer brand bid trading precursor
Topic 919,seed take school argentina will mock henman election young open
Topic 920,that also delta base which lse wednesday boerse offer since
Topic 921,all work success moore long ago age know year molyneux
Topic 922,who film star year oscar actor play first one she
Topic 923,have they but after when two year for out come
Topic 924,bell citizenship Muslim faith promote Christian teach community society heritage
Topic 925,with say this claim brown book there they that tell
Topic 926,party vote European assembly interested politics london immigration show announce
Topic 927,iraq Iraqi hadi oil alexander blackwatch baghdad social political situation
Topic 928,its have share make company firm group from business that
Topic 929,profit year sale three fuel analyst low march expect report
Topic 930,factory aston pinochet cheap speed david long initially unveil summer
Topic 931,from first get play game neath right will time cardiff
Topic 932,gaming release wembley microsoft march title xbox developer confirm blb
Topic 933,have you with there this not from year for just
Topic 934,borussia currency own almost until franc appear next old colonial
Topic 935,that for say year but will time all this consumer
Topic 936,have say will that right public first any five tell
Topic 937,engine recall union from could lesotho garment alfa worker model
Topic 938,have say film from with but star movie festival see
Topic 939,draw redknapp southampton they prutton brentford saint manchester away january
Topic 940,mobile music download operator use you handset work babinet bandwidth
Topic 941,game but half see get well into just help have
Topic 942,labour brown chancellor for speech minister service tell prime britain
Topic 943,rock two song record album singles presley sell into chart
Topic 944,trek newcastle bowyer baros kluivert rally enterprise star upn sci
Topic 945,lord scarman leave action Irish family friend which jet ability
Topic 946,Palestinian Israeli say peace abba israel conference British attack blair
Topic 947,she British personal qualify edge where mcilroy fraction jol benazir
Topic 948,for more will digital its than could work with how
Topic 949,bank country American about venezuela latin poll citizen america more
Topic 950,sentence murder idol intruder murderer guideline throw blunkett drug kelly
Topic 951,year console for more than psp this new sell life
Topic 952,have but for with game play win side team england
Topic 953,say not that for rule person month have what you
Topic 954,have but club that move sign want out from still
Topic 955,marley africa obvious ambassador mankind endlessly downhill guinea everywhere assemble
Topic 956,price december house november figure rise month from datum ons
Topic 957,turkey blair cyprus peace guarantee world accept premier hail human
Topic 958,kick fly henson take air boeing travel booming option premier
Topic 959,have for but after year from take win first now
Topic 960,recycle whitbread levy book billion awareness seychelle winner recycling return
Topic 961,connor with tennis long young whole uefa match hope week
Topic 962,drug test white ban anti doping agency substance face charge
Topic 963,mccormick kipchoge edinburgh morpeth berhanu kathy gavin double mike metre
Topic 964,aid will single band year with sell also record new
Topic 965,she really look what material skin network story bad thompson
Topic 966,they home burnley replay against round time vulnerable fifth wenger
Topic 967,bate lorimer tough tirelessly mantel elland deduction sainsbury survival incoming
Topic 968,chelsea shot goal gudjohnsen header sub keeper home lampard break
Topic 969,high economy price economic market state policy stock its list
Topic 970,only hybrid like opportunity many book plan into create may
Topic 971,brown election ball rise chancellor would rule don budget rate
Topic 972,for theatre award bbc boy london nomination last its well
Topic 973,grow india recovery palmer ontrack malfunction korea virus common lavatory
Topic 974,channel last bbc audience television housewife january share have one
Topic 975,say for year out more much not good cost one
Topic 976,year sale deal have firm say would mobile market sell
Topic 977,don
Topic 978,for have brown say blair that election labour which over
Topic 979,say have for that they new not but would which
Topic 980,parliament tax from reduce house current khatami chamber foreign david
Topic 981,that have say they for but with will one than
Topic 982,woman winner smith prize man about include book child vogt
Topic 983,scotland six italy victory side nation game but penalty edinburgh
Topic 984,lie fox attack about repay country accuse ashcroft lord when
Topic 985,asylum immigration system tory clarke migrant seeker point visa want
Topic 986,oil company contract field from resource iraq develop gas production
Topic 987,view germany German about high documentary begin weak dollar badge
Topic 988,have say they pay state also follow more site off
Topic 989,ireland they england gara penalty from half minute win side
Topic 990,blair tell brown government minister about prime not party chancellor
Topic 991,mail spam spammer service message campaign anti send security via
Topic 992,person use image not point character member choose model party
Topic 993,game you rather much like visual can when artist really
Topic 994,award good win for winner year open will set while
Topic 995,dam china power yangtze environmental gorge energy halt river plant
Topic 996,very with out from academy see first there like whole
Topic 997,they media that rule marry marriage many who person solution
Topic 998,computer control that person more time researcher york special sinclair
Topic 999,trend cea gate product showcase next several grow shipment packard
