Topic,TopWords
Topic 0,fine aragone action Spanish decision racist spain hold punishment British
Topic 1,firm for say that foreign guilty act with sec listing
Topic 2,that have say its which many could see from one
Topic 3,hip Spanish millan for they language that com just but
Topic 4,say government minister sell off law office sunderland ukraine mill
Topic 5,cement holcim hingis world acc Swiss hold pattaya aggregate charity
Topic 6,set win with break good but third first three take
Topic 7,henry wal persie set pire thierry robin reye gunner equalise
Topic 8,have new edu for write article what not good fight
Topic 9,battlefront andreas gameplay very capture familiar ewok bike planet revisit
Topic 10,aid disaster that world asia person affect travel sri impact
Topic 11,fiji capt samoa lead northern bortolami clive leicester north match
Topic 12,mci verizon offer qwest phone bid worldcom takeover telecom former
Topic 13,euro analyst firm sell sale company heineken restructuring European rossignol
Topic 14,harrier belgrave essex barnet shaftesbury middlesex eal hounslow windsor slough
Topic 15,cent peer that one copyright man game hand say server
Topic 16,tata datum beam route pass lay cable tfl infra rain
Topic 17,tax budget cut spending further raise deficit pre modest milburn
Topic 18,vehicle allow side great transport night important one pitch march
Topic 19,council edinburgh ead camus Scottish forgeard commission group fear draft
Topic 20,buhecha bollywood pountney dvd guilty fake legitimate week inlay budge
Topic 21,she trust politician career election opportunity next today role figure
Topic 22,for that from you show look with what take like
Topic 23,darlington royal receive mowden rectify delivery north elector necessary resident
Topic 24,wale team england rugby this with scotland ireland france south
Topic 25,hewitt win two Australian final four slam set johansson after
Topic 26,trainor shrink life mugging detainee international behind judgement pack fuel
Topic 27,woman deccan india atr visa Indian case sexist undergo researcher
Topic 28,have that for download say art they than million compare
Topic 29,party blackpool will conference manchester event labour host hotel much
Topic 30,cartridge printer ink date cost inkjet lawsuit woman sue suit
Topic 31,usada beastie newton sampling uphold note copyright over flutist yauch
Topic 32,have its with they two that say after into move
Topic 33,stem cell research howard tissue scientist ongc disease science recent
Topic 34,kilroy silk ukip leader robert mep election general share leave
Topic 35,radio hop rap world station one group production spain web
Topic 36,austria musical trapp von hammerstein Austrian production consider sound volksoper
Topic 37,they blog category also this one blogger nomination nominate from
Topic 38,its supply kraft chavez famous field coincide worldwide similar world
Topic 39,have but they for with will there england say that
Topic 40,music age peel for internet sharing even person format illegal
Topic 41,donation political commission state mittal gift its funding list candidate
Topic 42,tobacco government court appeal firm case group altria smoking company
Topic 43,brown election government through trust squabbling marr day editor general
Topic 44,cebit home dmb broadcasting gsm nokia dvb vendor trialle fair
Topic 45,they that say but for one survey more third need
Topic 46,that work service have financial scheme lead plan company under
Topic 47,school this system user computer student project they station use
Topic 48,good award for comedy britain win little three night over
Topic 49,labour party election say tory would will campaign more seat
Topic 50,wine buy canada sativex approval litre yantai changyu illva maker
Topic 51,she who host person rise use figure also all bear
Topic 52,album music soul include new rap act list number four
Topic 53,grady restore farce kenneth coolly samuel ease overtake aspect
Topic 54,hunting law chase fox ban legal rwanda cruel sport bradshaw
Topic 55,this tie just place there problem premiership way part good
Topic 56,terry rio medical ferdinand alongside
Topic 57,archive parking divorce road addison testimony blow page discover Protestant
Topic 58,ice rink skater thin presenter strictly torvill skating tess gascoigne
Topic 59,they england good owen goal over back have khan several
Topic 60,blog uwb good blogline lanzone weblog radio let sea writer
Topic 61,charle west performance unreleased jone anthony tribute feature song recording
Topic 62,have that for all there will this come not about
Topic 63,network file peer download not music film money they net
Topic 64,she markova alicia vanity sharp witherspoon thackeray paula dame reese
Topic 65,university refugee asylum some fair private genuine waste abuse racist
Topic 66,referee decision aid alitalia official international kaplan carrier rugby match
Topic 67,have say murder dortmund for also all after lose off
Topic 68,that have party they election what from issue for now
Topic 69,have show with who she for from win after bbc
Topic 70,that not have will but would they there think with
Topic 71,they kenteri test kenteris iaaf miss have athletics tribunal athen
Topic 72,ukip kilroy this silk hockney you should legal verita spokesman
Topic 73,kasabian meighan club weir need rutland manson killer age water
Topic 74,viotti fenice opera conduct include massenet orchestra conductor theatre English
Topic 75,concert music glasgow helen session secc nicholas Scottish december choose
Topic 76,they that have but for will this can year you
Topic 77,machine offer dvd datum basic video money potential burner demand
Topic 78,five poll should leary quick speak before they deal hitzlsperger
Topic 79,ukraine yushchenko raskin gas team deal turkmenistan turkmen ukrainian dispute
Topic 80,have that for with but this will from year not
Topic 81,office train say mobile would access set announce offer release
Topic 82,will have its economy that government country for project india
Topic 83,user software microsoft use website security google version for release
Topic 84,will with this ibm year you bbc what use computer
Topic 85,dvd copy ripguard macrovision will rip protection piracy practice most
Topic 86,smart greenfield collin fabric nanoscale textile normally wrist light arrogantly
Topic 87,keegan forest spur reid arthur tottenham nigel previous shearer kenton
Topic 88,want Chinese its strike French could sundance salary servant during
Topic 89,reserve network tysabri use biogen elan early well wolong idec
Topic 90,aid debt indonesia sri tsunami disaster club vaccine poverty paris
Topic 91,council they use local system life person all sport because
Topic 92,domain name for icann back internet proposal two there travel
Topic 93,she happen happy three player absolute mother daughter subject problem
Topic 94,production jay project def jam tonne hop producer fella roc
Topic 95,police anti under chief community group area policing exercise cso
Topic 96,virus that window program security have microsoft mail say with
Topic 97,civil who row member website honour spokesman Semitic Jewish series
Topic 98,for have will its japan more time after cut year
Topic 99,have but that say after second win this will final
Topic 100,division cyber off power ntpc india arsene debut amit flotation
Topic 101,machine gene blue top speed supercomputer teraflop list fast test
Topic 102,police authority commissioner constable brixton riot lawyer human policing disturbance
Topic 103,profit share fourth firm two first face new full period
Topic 104,she claxton athlete out star sarah stage close three pull
Topic 105,have for take film television she that anti orchestra balco
Topic 106,attack network machine pass bot system camera information different build
Topic 107,but after club have from want will bellamy redknapp ranger
Topic 108,with gloucester harry who cuaron warner wale potter name bath
Topic 109,safety health whistleblower workplace rep barber safe tribunal unsafe redress
Topic 110,person than more have with say united neville vieira incident
Topic 111,italy for ireland murphy lead stringer gara driscoll nitoglia Irish
Topic 112,store woman uganda Ugandan organiser ban ensler homosexuality sexual ngo
Topic 113,say European year festival kosslick berlin cinema man win American
Topic 114,book economy rigorously confidential loyal discussion unify seek rift bias
Topic 115,dollar about currency cost fall slide reserve down monday market
Topic 116,view work bush also blocking service president george block campaign
Topic 117,say Jewish have livingstone mayor apologise for ken reporter tuesday
Topic 118,comedy aviator dicaprio leonardo dergarabedian estimate hatcher hughe howard weekend
Topic 119,message send multimedia phone they customer not mobile more number
Topic 120,show ross lucy bach fletcher radio king pound die part
Topic 121,with jackson all stand target issue add who advocate criticise
Topic 122,apple inbev book interbrew world ambev volume scan link firm
Topic 123,hewitt speegle huge melbourne speech renton cec read rnib impairment
Topic 124,jacobsen Saudi flight arabia suspend riyadh unauthorised march jeddah heathrow
Topic 125,file bittorrent server host link lokitorrent sharer sharing edonkey copyright
Topic 126,reggae murder homophobic beenie sizzla promoter coalition outrage stop dancehall
Topic 127,sella allegation michalak sydney incident lawyer fawcett mcdonald delaigue violence
Topic 128,brazil match group february gilbert tournament coach strange split bafana
Topic 129,have that say for they year will not which report
Topic 130,labour election blair campbell michael conservative very howard Democrat general
Topic 131,down want leicester kick British fight try about really not
Topic 132,have say market company for than insurance but most big
Topic 133,budget deficit bush israel cost congress trillion military president under
Topic 134,economic cuba because few tax india affect Cuban policy American
Topic 135,also tuesday before jone pace december bank credit september warn
Topic 136,arsenal goal player campbell almunia lehmann keeper portsmouth don against
Topic 137,have they person net online this broadband get many accord
Topic 138,would say plan could lib new liberal already bill dem
Topic 139,jone she say drug performance doping marion medal enhance would
Topic 140,russia wto member membership progress johannesson knockout counterfeiting reverend Roman
Topic 141,start against add barcelona robben game corry can jason tell
Topic 142,have year executive with car last its which chief market
Topic 143,southcorp rule say that top new first company horror panel
Topic 144,have she but back open game year since lose who
Topic 145,prisoner confess arm argument off incentive sheriff famous piece word
Topic 146,meet focker day office write when box with weekend albert
Topic 147,from bbc tell there fox time which add programme also
Topic 148,they compensation classic line hope until fsa mumbai split decision
Topic 149,she play open say Australian beat first davenport after seed
Topic 150,from say south debt help year have tell lanka asia
Topic 151,have bet actor favourite bookmaker hill william odds bond with
Topic 152,telegraph deal general land registry deputy report committee after register
Topic 153,musician music emi home release high than currency fall now
Topic 154,say have blair that not minister they with but prime
Topic 155,social video year chain more technical publish content important supply
Topic 156,for have which consumer from technology say that will with
Topic 157,have year for they last new week over record album
Topic 158,year high show rise figure last economic japan economy with
Topic 159,book flight wonder character profitable job staff produce buffy malware
Topic 160,from base ebay most datum more available than when user
Topic 161,play two have game great year good first win before
Topic 162,system say hague would have will give also continue hope
Topic 163,will party person political who election home may with campaign
Topic 164,film producer star who aviator name good nominate evan actor
Topic 165,child kicker medical aynsley mental green prof hare pitch revolution
Topic 166,contest ipod eurovision song broadcasting hold programmer union denmark past
Topic 167,academy smith place black hat constantine reeve perry mad woman
Topic 168,community Muslim police penalty from mosque leaflet search likely scott
Topic 169,for when become former over card lead house will resign
Topic 170,musician lawsuit artist sue abc woman rapper snoop successful agree
Topic 171,ireland france republic switzerland island cyprus israel faroe kerr group
Topic 172,bath squad edinburgh shark bell beattie tindall recall phil smith
Topic 173,she singer court case tell film star hill michael love
Topic 174,slave keegan kid weaver defender louisiana stopper programming historic operating
Topic 175,oscar stuart academy norwich spend until davey facility experience voter
Topic 176,ferocity brazil
Topic 177,label group buy Christian store couture washington want evanescence feroz
Topic 178,deutsche boerse lse shareholder bid exchange london tci offer say
Topic 179,that for have from minority year with they company this
Topic 180,airline panda operate which varig airway passenger share aviation delta
Topic 181,age vote say old they pension want worker person for
Topic 182,cut save because economy finance economic some friday expect pay
Topic 183,festival will nasdaq read sale park line public iron only
Topic 184,ipod format piracy jupiter aac napster artifice unfair recording satisfaction
Topic 185,round she who beat russia final martinez face quarter davenport
Topic 186,have that from with this there say after now make
Topic 187,that spyware have they user computer program many security software
Topic 188,smith man electrolux present commentary alan chief titchmarsh grit aycliffe
Topic 189,christmas this zafi infected gerrard translate card open line pose
Topic 190,bet big brother odds lush eviction add ladbroke punter bookmaker
Topic 191,woman Olympic man six maternity hewitt team compete world training
Topic 192,that about net country attack under month into germany international
Topic 193,they for tax election party labour would have not say
Topic 194,lira act spam Turkish identify leadplex trotter deceptive turkey value
Topic 195,vehicle gta car upon grand city suv crash sequel endorsement
Topic 196,sunderland larne delta lawlessness inver outset burnley prosecution pose briton
Topic 197,broadband lawyer net this kite lending question provider time contract
Topic 198,wright jame rooney phillip city manchester ronaldo unite dunne everton
Topic 199,will game bond gift give interest stock relative trust face
Topic 200,security service alert home computer may year plaid cymru safe
Topic 201,video technology device content watch year will mobile store such
Topic 202,rugby with for england club six player newcastle who cup
Topic 203,price oil casino crude barrel gambling supply weather temperature winter
Topic 204,say have offer more will from with its share for
Topic 205,pension union age retirement work worker employer amicus relay person
Topic 206,charle home education young introduce pupil black jazz scheme influence
Topic 207,broadband number million research over time past analyst year online
Topic 208,economy tax growth spending say year forecast could rate will
Topic 209,commodore brand crisp donkey bankruptcy need who supermarket
Topic 210,uwb ultra usb kharkov klin swallow finances amongst reality sound
Topic 211,for say year film music make chart have follow release
Topic 212,qanta Australian philippoussis hopman australia doubt strengthen customs cabin setter
Topic 213,that have for they not will can this more with
Topic 214,bolton candela dyer allardyce giannakopoulo bowyer shearer hierro jaaskelainen hunt
Topic 215,say but more which person with could digital set service
Topic 216,show new screen original plan audience programme series version produce
Topic 217,that for have not can one say bbc which but
Topic 218,campbell labour tbwa campaign journalist fuss newsnight realise billion pig
Topic 219,share investor executive coal buy lakhani mine issue stock into
Topic 220,tax council service local account fund government may wale authority
Topic 221,dutch china gogh van death murder news media make fortuyn
Topic 222,hiv mrs prince bowle recession parker report couple treatment important
Topic 223,this there new but take look design you series into
Topic 224,have about attack comment than say party its clarkson against
Topic 225,santander botin custom panel settlement member sized enlargement filings tit
Topic 226,argonaut opt broadcaster fire veto such treaty staff agreement small
Topic 227,osbourne ozzy series sharon family black sabbath heavy rock band
Topic 228,its bank also player keep korea with card charter creative
Topic 229,growth quarter figure month rise from third economist expect estimate
Topic 230,year also fine show new about include broadcast during television
Topic 231,but work world for school look say start federer really
Topic 232,service offer monsanto player cheap user song monthly way own
Topic 233,European mail from service more state possible which that france
Topic 234,say have that good win play one first with not
Topic 235,its sale profit year market euro share fall firm say
Topic 236,have win england but they season final team last down
Topic 237,italy lewis useless potato guide research slim centre energy agricultural
Topic 238,for say will have that year from with than they
Topic 239,for that have say would they union this there about
Topic 240,council minister before scotland community which tennis happen sizzla because
Topic 241,book harry potter film depp series child long story burton
Topic 242,have houston say suspend ukip after candidate member view release
Topic 243,job smith walter vogt tuc former burn Scottish sir tommy
Topic 244,card fraud payment plastic pin apac chip credit present retail
Topic 245,that say they use can new not have you would
Topic 246,have software that datum colour use computer wong directive work
Topic 247,capgeminus discover
Topic 248,fannie sec pay mae mortgage investigation agree chief industry congress
Topic 249,hold anti man foreign rule appeal nine ruling European deport
Topic 250,rate kennedy increase year rise this month record one during
Topic 251,for italy with try william after final bergamasco ball marigny
Topic 252,have with that will digital more access online who computer
Topic 253,president relay peso kirchner valentine relief freeze performance royal day
Topic 254,team athen athletics Olympics win drug paula also science rule
Topic 255,you from with tory who just but also comment not
Topic 256,that music they have person with not say make you
Topic 257,they have for this with person but not get make
Topic 258,dollar euro deficit sale from trade than mercedes its year
Topic 259,blair election would plan follow newspaper prime labour bbc you
Topic 260,club glazer unite proposal offer board bid manchester stake financial
Topic 261,use could website language fake system but user than idn
Topic 262,programme carlile salad pedometer arch fruit revival legislation unless
Topic 263,mobile phone that call use operator network service also vodafone
Topic 264,they year for make against over world first win two
Topic 265,song good angel robbie last British brit sayeed williams joy
Topic 266,ballet rooney manchester unite they united ronaldo dancer what ferguson
Topic 267,high quarter report food election will false optimism total space
Topic 268,when scheme introduce also shadow crime source conservative secretary pledge
Topic 269,game half referee over try kick line ball could miss
Topic 270,bush theatre climate president emission kyoto kerry swansea despite iraq
Topic 271,you viacom corbett fcc too comedy agree radio female old
Topic 272,food slavery assistance factory agriculture million programme Ethiopian owner fao
Topic 273,new group campaign issue too show massive conservative announcement will
Topic 274,report region console divide india pakistan minor hand power kashmiri
Topic 275,straw embargo lift foreign referendum question china arm constitution would
Topic 276,subsidy visitor fao figure number agricultural country alva saumarez tariff
Topic 277,department change daytime exclusive poem efficiently chicago pour effectively similar
Topic 278,have club with souness for manager who bid player manchester
Topic 279,bbc sport piero broadcast analysis supervolcano adaptation holocaust detail season
Topic 280,she have that say tell who when will very back
Topic 281,sun grid hour computing service will have system use say
Topic 282,phone virus mobile use commission number skull vodafone hogan september
Topic 283,iraq galloway bafin citigroup contrack hassan foot metatarsal baghdad operation
Topic 284,performance show star musical pop sir julie child book due
Topic 285,cup davis henman britain murray tennis slam bogdanovic future rubber
Topic 286,doherty return london korn guitarist bail performance condition curfew libertine
Topic 287,actor dougla singh prejudice bride rai aishwarya romance journal chase
Topic 288,theatre producer bollywood bernath hollywood wallace west English popular final
Topic 289,presley coach fool spur week elvis legend pop impersonator jailhouse
Topic 290,edward band edwards manic disappearance tansley street car preacher gear
Topic 291,show three one radio john all host try new station
Topic 292,game puzzle character blinx male sequel original feline gritty unique
Topic 293,deal with year under leslie africa long date promise million
Topic 294,student university fee poor from win devon high delta grant
Topic 295,party election public not with cap also should spend cut
Topic 296,will viewer star audience dtt television software allow between new
Topic 297,party that say dem minister there but service tell they
Topic 298,account creditor crisis parmalat sue loss deposit trust trading bust
Topic 299,cent disloyalty inferno creep collective tense solo protege confession
Topic 300,central solidere mcconnell lebanon mohi assassination rafik assassinate phi renewed
Topic 301,open final Australian round match beat event French hardenne henin
Topic 302,from Scottish they content for scotland model legal also first
Topic 303,win she year indoor long European second good finish sec
Topic 304,they see portishead aid bristol haven money sound tsunami bono
Topic 305,gadget device consumer one sale for sell computer store also
Topic 306,fiat compete release after play six arese slight attention hour
Topic 307,ink light kyrgyz idol reader voter ultraviolet associate competition thumb
Topic 308,prosecutor after greenspan highlight account later brown could peston chairman
Topic 309,say mac mini for apple ipod will with that machine
Topic 310,for its year from also group part company over make
Topic 311,property buyer cable shell time threshold market van shipside der
Topic 312,viewer eat nbc rat stunt programme aitken contestant sue mid
Topic 313,they not that day who after there with say many
Topic 314,she feta villalba merrill greece decision tribunal diaghilev designation lynch
Topic 315,for all but have more run what marathon well though
Topic 316,bbc top programme entertainment pop viewer news support audience online
Topic 317,from analyst growth year france export demand than fast strong
Topic 318,conte pound balco take victor guilty ioc strip steroid truth
Topic 319,good for award film win star this also vera drake
Topic 320,that could industry run time argue because not German problem
Topic 321,have arrest woman police she who only kill follow British
Topic 322,pay wage minimum business work low employer earn wages employee
Topic 323,pause bench decide Libertarian card fight intrude gutsy ethnic transport
Topic 324,card country bell test you biometric identity fingerprint crystal credit
Topic 325,have that with but this not one can you thing
Topic 326,genius leibovich peso colombia dedicate subsidy education artful ephemera dizzy
Topic 327,pernod wembley change multiplex savings shake target affect priority whisky
Topic 328,injury play will league after who knee cup back also
Topic 329,gardener nielsen gold francis lewis relay jason usability championship birmingham
Topic 330,budget parliament leak common resign finance name before date confidentiality
Topic 331,nation year world three jamie country huge suffer athletics athen
Topic 332,airline independent yoran air network department association European base delay
Topic 333,music apple itune song bundle launch interesting open wma gellhorn
Topic 334,brown chancellor poverty tory plan education visit pledge offer towards
Topic 335,discard
Topic 336,patent software open microsoft source they use company flaw which
Topic 337,abortion child elgindy school debate education issue policy one professor
Topic 338,nomination academy herlihy liam whose miyagishima chest abandon andrew motion
Topic 339,cultural create muffin engrossing till anxious carr diane scarlet
Topic 340,podcast curry podcasting you listen automatically audience source software content
Topic 341,have will for after injury liverpool six first also league
Topic 342,purushotma Spanish teacher jose gunner single phenomena energie hans assumption
Topic 343,forsyth British die ira war fear death become tyranny state
Topic 344,lion fit start need henson pretty foot quite against special
Topic 345,visa titan benin pay kerekou mccune mmf telecommunications prosecute criminal
Topic 346,that have they for will but say what there this
Topic 347,with last cost one euro company have brand when united
Topic 348,milk dairy solid eat gamecube snake cake motion jokey grounding
Topic 349,fiat car marchionne maserati ferrarus romeo alfa part stake motor
